post_dates,title,url,full_text
2020-12-01,"애플페이 한국 도입, 왜 이렇게 지지부진할까?",https://blog.naver.com/great97k/222189465795,"["" 아이폰을 사용하는 국내 사용자들 모두가 한마음 한뜻으로 한국 도입을 기다리는 서비스가 있습니다. 다름 아닌 애플 페이(Apple Pay)입니다. 2014년 처음으로 공개된 애플 페이는 NFC 기반의 올인원 결제 서비스로, 거래 은행 계좌와 카드를 등록하여 사용할 수 있습니다.  애플페이 한국 도입을 둘러싼 루머는 2017년 이후 줄곧 계속되었습니다. 하지만 애플이 0.15% 결제 수수료와 3000억 원 상당의 NFC 단말기 보급에 필요한 비용(업계에서는 개당 15만 원으로 추산 중)을 한국 카드사에 요구하면서 애플페이 한국 도입은 빈번히 무산되었습니다.  최근에도 국내 금융사에서 애플페이 한국 도입을 위해 물밑 협상을 진행한 사실이 매체에 의해 알려지기도 했으나, 코로나19 사태 장기화로 인하여 지지부진 해진 것으로 전해졌습니다.  그동안 국내 금융회사들은 애플페이를 한국에 도입하기 위해 많은 노력을 기울였습니다. 애플의 높은 브랜드 이미지는 물론, 아이폰을 사용하는 약 300만 명의 국내 사용자 및 충성 고객을 포섭할 수 있다는 계산 때문이었습니다.  하지만 애플페이 국내 도입은 앞으로도 어려울 전망입니다. 이유는 크게 두 가지입니다.  LG Pay 먼저 보편화된 국내 사업자들의 다양한 간편결제 기능으로 애플페이의 상품성 및 희소 가치가 점차 저하되고 있기 때문입니다.  대표적으로 국내 스마트폰 제조사(삼성전자, LG전자)가 직접 운영 중인 삼성페이와 LG페이는 물론, 네이버 페이, 카카오 페이 등 다양한 간편결제 서비스들이 국내 시장을 두고 치열하게 경쟁하고 있습니다. 이 때문에 애플이 제시한 NFC 단말기 보급 및 수수료 부담 등 막대한 자금을 투자하여 애플페이 국내 출시를 성공시키더라도, 경쟁 업체들을 쉽게 물리치고 선두주자 반열에 오를 수 있을지 가늠이 어려워졌다는 것입니다.  또, 최근 국내 금융사들이 애플과의 협상 대신 아이폰에서 이용할 수 있는 자사의 페이 서비스 안정화 및 보급에 매진하고 있는 추세도 애플페이 한국 도입을 부정적으로 바라보는 이유입니다.  최근 국내 은행 등 금융사들은 아이폰 뒷면에 NFC 인식 스티커를 부착하여 결제를 할 수 있도록 돕는 페이 서비스를 런칭하는 등 애플페이를 대체할 수 있는 자사 서비스를 지속 출범 중에 있습니다. 특히 자사 페이 서비스는 애플페이 한국 도입보다 훨씬 적은 비용이 소모되어 효율적인 운영이 가능한 만큼, 국내 전문가들은 앞으로도 이런 기조가 한동안 계속될 것이라 전망했습니다.  Samsung Pay 이미 갤럭시, LG 스마트폰을 사용하는 국내 소비자를 중심으로 '국내 스마트폰은 아이폰과 달리 간편결제가 가능하여 편리하다'라는 인식이 만연해 있는 상황.  코로나19 사태 장기화와 더불어 애플페이의 국내 도입보다 자사 간편결제 서비스에 투자하는 것이 더 효율적이라는 금융사들의 셈법으로 국내 아이폰 사용자들의 애플페이 활용은 앞으로도 불투명할 전망입니다.  하지만 일각에서는 최근 간편결제 시장이 무서운 성장을 보이고 있으며 구글과 같은 글로벌 기업도 구글페이, 구글카드 등 공격적 행보를 보이는 것에 비춰, 애플이 국내 금융사들을 대상으로 수수료 등 협상 조건을 완화할 수 있다는 예상을 내놓기도 하였습니다. ""]"
2020-12-01,[애플페이대안 추천]스티커형 티머니카드 사용후기,https://blog.naver.com/munss92/222180195826,"[' 오늘은 애플페이 대안 제품 하나 소개해 드릴게요.  지하철이나 버스 사용량이 많으신 분들은 좀 유익한 정보가 되지 않을까 싶네요  제가 구매한건 티머니에서 나온 스티커형 티머니 카드  라이언이 귀여워서 구매한것도 있습니다.  제가 구매한 링크 남겨드릴게요. 티머니 공식쇼핑몰 티머니,티머니교통카드,티머니카드,카카오티머니,라인티머니,특판카드,티머니특판,구매 t-zone.co.kr 1차 판매시엔 일시 품절이었는데 지금은 재고가 있더라구요:)  저는 할인중이라 9900원에 구매를 했습니다. 티머니 스티커 사용을 위해서는 티머니페이 어플을 설치해야해요.  사용방법과 부착 위치가 나와있습니다.  아이폰 nfc 인식 부위에 부착을 해야하는데 주의하실점은 티머니 스티커를 붙이면 다른 nfc 인식은 불가능하다는점 알고 부착해주세요. 티머니스티커 본체  여분 스티커도 함께 동봉되어 있어요.  귀여운 라이언 얼굴이 졸귀   티머니페이 어플을 설치하고 본인인증 후 회원가입 진행 그리고 아이폰에 nfc 인식 시켜주시면 됩니다.  정상적으로 등록이 됬네요.  기존에 사용하던 티머니 카드도 여기서 일괄적으로 관리 가능합니다. 티머니가 제로페이와 함께 사용이 가능해서 범용성이 넓어요  한달에 50회까지는 수수료 없이 무료로 충전이 가능하니 충분할거 같아요. 스티커 본품은 생각보다 크기가 있어요. 간단한 팁을 드리자면 부착 전에 nfc 태깅이 되는 위치를 확인하시고 붙이시는게 좋아요.  이렇게 붙이고 저는 케이스 끼우고 사용하는데 정상적으로 잘 인식이 되더라구요  그러면 오늘도 역시  애플페이 대안 티머니스티커 후기 마무리 지으면서  이만  빠싱 ']"
2020-12-01,애플 페이로 매장에서 구매할 때마다 애플이 RED Global... ,https://blog.naver.com/online4/222160532607,"['  2020년 12월 1일 애플은 PRODUCT (RED) 캠페인과의 파트너십을 강화했습니다.  (RED) 기기와 액세서리의 적격 수익금 100%는 글로벌 펀드의 COVID‑19 구호 활동으로 리디렉션됩니다.   https://blog.naver.com/online4/222160519447 애플, PRODUCT (RED) 수익금의 전부가 전염병 구제에 기부 할 예정 애플의 PRODUCT (RED) 기기는 오늘 애플 웹 사이트의 키포인트입니다.애플은 (RED)와 협... blog.naver.com   애플은 또한 Apple Pay로 매장에서 구매할 때마다 1 달러를 기부할 것이라고 발표했습니다.  애플은 적격 국가의 사용자에게 애플 웹 사이트에서 Apple Pay로 구매한 모든 항목을 이메일로 발송하고 있습니다.   Apple Store 앱 또는 Apple Retail Store에서도 (RED) Global Fund에 1 달러가 기부됩니다.  RED) 조직은 아프리카의 HIV 및 AIDS 퇴치를 지원하는 것으로 알려져 있으며 올해 모든 기부금이 COVID-19 퇴치에도 도움이 될 것이라고 발표했습니다.   https://www.apple.com/product-red/ (PRODUCT)RED For 14 years, our partnership with (RED) has helped fund programs to treat HIV/AIDS. Every (RED) purchase gets us closer to an AIDS-free generation. www.apple.com   이제부터 2020년 12월 7일까지 (RED)를 통해 COVID-19 및 AIDS 퇴치를 지원하기 위해 Apple은 apple.com, Apple Store 앱 또는 Apple Store에서 Apple Pay로 구매할 때마다 글로벌 펀드에 1 달러를 기부합니다.  애플은 수익금을 기부금으로 되돌릴 수 있는 레드 케이스, 심지어 레드 아이폰과 같은 다양한 제품을 제공하기 때문에 PRODUCT (RED) 캠페인과 오랜 파트너십을 유지하고 있습니다.     애플 , 애플페이 , 전염병 , 기부금 , 프러덕트RED , 에이즈 ,치료프로그램, 의료시스템 , 아프리카 ,  애플, 애플페이, 전염병, 기부금, 프러덕트RED, 에이즈,치료프로그램, 의료시스템, 아프리카, ']"
2020-12-01,안된다 (1탄 -삼성페이와 애플 페이 NFC 결제) #아이폰 12,https://blog.naver.com/jasnaro/222190993155,"[' 지난 10월 말 출시된 아이폰 12는 거의 한 달 만에 60만 대가 팔린 기염을 보였다고 한다. 아이폰 12 미니 30일 통신업계에 따르면 지난달 30일 국내 출시된 아이폰 12는 최근까지 한 달간 이통 3사에서 50만 대 안팎이 팔린 것으로 추산된다. 여기에 아이폰 시리즈 전체 판매량의 약 1520%가 이통 3사가 아닌 온라인몰에서 자급제 물량으로 판매되는 것을 고려하면 10만 대가량이 이들 채널에서 판매됐을 것으로 분석된다. 통신 3사와 자급제 채널을 포함한 아이폰 12 전체 판매량은 한 달간 60만 대를 넘을 것으로 추정된다. 전작인 아이폰 11과 비교해도 20% 이상 판매 속도가 빠른 수준이다.  https://biz.chosun.com/site/data/htmldir/2020/11/30/2020113000572.html 그러나 아이폰 12를 비롯한 모든 국내 아이폰 유저들의 가장 큰 불만은 바로  애플 페이를 사용하지 못한다 는 점.  애플 페이로 교통카드를 이용하는 건 아이폰 유저들에겐 여전히 그림의 떡  애플 페이의 교통카드 태깅은 안된다 아직까지는 애플 페이는 지난 2014년 10월 서비스를 시작했다. 현재 60여 개국에 도입됐으나 한국 출시는 미뤄지고 있다. 애플 페이 한국 도입은 수년간 아이폰 사용자의 희망사항이었다.  삼성페이는 애플 페이 도입 이듬해인 2015년 8월 도입 됐다. 한국·미국·중국·스페인·호주·싱가폴·브라질을 시작으로 인도와 유럽 국가 등으로 서비스를 확대했다. 지난해 기준으로 한국 누적 결제 금액은 40조 원이다. 가입자는 1만 4천 명 수준이다. 세계 시장으로 눈을 돌리면 삼성페이보다는 애플 페이가 앞선다.  미국 리서치 기관 BRP 컨설팅 조사에 따르면, 미국 소매점에서 이용할 수 있는 모바일 결제 서비스 1위는 애플 페이였다. 소매점 38%가 애플 페이 결제가 가능했다. 소매점 22%는 1년, 11%는 13년 안에 애플 페이 결제 시스템을 구비할 계획이라고 답했다. 2017년 기준 조사이니, 계획대로 진행됐다면 현재 미국 소매점 69%에서 애플 페이 결제가 가능한 셈이다.  * 출처 : 민중의 소리 기사에서 발췌 근데 왜 국내에선 애플 페이가 안될까 설마 애플이 기술력이 부족해서   결론부터 말하자면 기득권 세력인 카드업체와 수수료가 무료인 삼성페이의 절묘한 궁합 시장조사 결과 저조한 NFC 단말기 보급률 유독 우리나라는 NFC 단말기 보급률이 낮다고 한다. 어디에선 1% 미만이라고 또 어딘가에는 10% 미만이라고 그런데 요즘 많이 이용하는 편의점에는 NFC 단말기가 모두 있던데 (자본력이 되는 대기업이 운영하는 편의점이나 대형마트에나 있는 거고 일반 소상공인이 운영하는 매장에는 없다고) CU 편의점과 이마트 24의  NFC 단말기 왜 요즘 같은 모바일 시대에 NFC 단말기 보급률이 그리 낮을까 미국과 유럽에서는 NFC 단말기 보급으로 애플페이, 삼성페이 등으로 스마트폰을 단말기에 대는 간단한 조작을 통해 결제를 실행하고 있다.  NFC는 결제 속도가 빠를 뿐 아니라 현재 가장 보안성이 뛰어난 결제 인프라로 꼽히고 있다. 스웨덴의 통신 분야 시장조사 서비스 버그인사이트(Berg Insight)는 2022년이 되면 전 세계 결제 단말기 10대 가운데 8대에서 NFC 결제가 가능할 것으로 전망했다. http://www.hani.co.kr/arti/economy/it/955639.htmlcsidx17463c863b5d0ed9b9ac22828f0f4c4 그런데 왜 우리나라는  신한·삼성·현대 등 다수의 국내 카드사는 2018년 7월까지 새로 교체되는 IC 단말기에 NFC 기능을 집어넣는 데 반대한다.  국내 NFC 기술이 통신사 유심(USIM ·가입자 식별 장치) 기반이어서 NFC를 통해 결제되는 경우 통신사에 수수료 일부를 내야 하기 때문이다. 한 카드사 관계자는 “가뜩이나 가맹점 수수료 인하 때문에 골머리를 앓는 판에 통신사에 결제 수수료까지 떼 주면 카드사가 남는 게 뭐가 있겠느냐라고 말했다.  삼성페이에 남은 시간은 길어야 3년…NFC 대중화 이전 승부해야 삼성전자의 모바일 간편결제 서비스인 ‘삼성페이(Samsung Pay)’가 국내 출시 두 달만에 가입자 100만명을 확보하며 순항하고 있다. 이는.. biz.chosun.com 결국 NFC 단말기 보급률이 낮은 건 기존 카드사들이 단말기에 NFC 기능 추가를 반대했기 때문에  IC단말기에 NFC 기능 추가 놓고 카드사 갈등 7월 영세 가맹점에 보급 앞두고하나ㆍBC 등 모바일 카드 진영은교체하는 김에 기능 넣자 주장앱카드 주력하는 대형 카드사들은 단말기 단가 2배로 뛰어 난색 집적회로(IC)카드 단말기 전환사업이 시작부터 암초에 부딪혔다. 정부가 보안이 취약한 마그네틱카드 사용을 차츰 줄여나가면서 IC 단말기 보급이 시급한 실정이지만 카드업계가 두 진영으로 나뉘어 다투고 있 www.hankookilbo.com 삼성페이의 무료수수료 국내 카드사의 일반적인 결제 수수료가 2% 정도인데 반해  애플은 애플페이를 이용한 결제 건에 대해 약 1%의 수수료와 200만 개 이상의 NFC 단말기가 장착된 가맹점을 요구했다고 한다. (삼성페이는 국내 카드사에 별도로 수수료를 요구하지 않는 공짜 서비스 최소한 아직까진...)  게다가 애플이 요구한 수수료도 애플페이가 도입된 다른 나라에 비해 2배 이상 높다고 (미국에서는 0.15%, 중국에서는 0.03% 수준의 수수료를 받는 것으로 알려졌다.) 삼성페이의 MST 방식 삼성페이는 NFC 단말기에서 사용이 가능하지만 기존의 구형 단말기에서도 MST 방식으로 결제가 가능하다. 꼭 그 이유만은 아니겠지만 우리나라 모바일 오프라인 간편결제의 80% 이상이 삼성페이를 통해 이루어진다고 한다. 금융감독원에 따르면 2018년 기준 국내 간편결제 이용 금액은 80조 1450억 원이며, 이중 19조 5420억 원이 오프라인 간편결제다. 삼성페이 는 이 시장의 81.6%를 차지한다 출처 : 금융감독원 결국 기존 카드업체들은,  1) 굳이 대당 10만 원이 넘는 NFC 단말기로 교체하지 않아도 되니 돈 굳어 좋고   2) 통신사와의 제휴를 바탕으로 모바일카드에 주력하는 하나카드( SK텔레콤 )와 BC카드( KT )에게 NFC 결제 시 주어야 하는 수수료를 내지 않아도 되고 그들의 점유율 확대를 원천봉쇄할 수도 있고  이래저래 모바일 시대에 역행하는 모양새지만 국내 핸드폰 점유율 70%에 육박하는 삼성 갤럭시와 수수료 무료인  삼성페이가 이미 1400만 명 이상의 가입자를 이끌고 있으니 기존 카드사가 굳이 쌩돈들여 NFC 단말기를 새로 도입할 이유도 필요도 없어 보인다.  아이폰의 애플페이 결제는 우리나라에선 글쎄 시장을 흔들만한 새로운 메기가 들어오지 않는 한 어려워 보인다. 다음 번 글{2탄)에선 아이폰 교통카드 태깅의 문제점에 대해서(젤리케이스에 교통카드만 넣고 쓰면 진짜 안되는건가  왜)  갤럭시는 되는데 아이폰은 안된다 (2탄 - 애플 패이 교통카드 태깅) 얼마 전 와이프가 드디어 애플빠, 일명 앱등이가 되었다.그간 잘 사용하던 갤럭시 S9 액정이 깨지고 마침... m.blog.naver.com']"
