post_dates,title,url,full_text
2020-06-01,국내 애플페이는 언제쯤? 예상해본 애플 WWDC,https://blog.naver.com/tech-plus/222002587787,"["" 다음 주 애플 세계 개발자 회의(WWDC)가 열린다. 매년 애플의 차기 신제품 방향을 알려주던 이 행사에서 올해는 가을에 출시할 아이폰12와 관련된 부분들이 공개될 것으로 보여 관심이 집중된다. 과연 아이폰12는 어떻게 변할까. 많은 사람들이 궁금해하는 새로운 기능 등 소식을 행사에 앞서 미리 유출된 소문으로 알아봤다.      홈 화면에 위젯이 바뀌는  iOS 14  아이폰12에 탑재될 새로운 애플의 운영 체계(OS)는 iOS 14다. 보통 공개 전 보안에 굉장한 공을 들이지만 올해는 중국의 아이폰 개발 버전으로부터 일부 내용이 유출된 바 있다.  홈 위젯 가상 이미지          @ Parker Ortolani  새 운영 체계에서 가장 눈에 띌 변화로 거론되는 것은 홈 위젯이다. 아이패드에 적용된 것과 비슷한 형태로 첫 화면에서 사용자가 원하는 정보를 커스터마이징해 보여준다. 홈 위젯은 안드로이드폰에서는 오래전부터 있어왔던 기능이다. 하지만 아이폰에서는 홈 화면에 별도의 위젯 기능을 지원하지 않았었고 이후 앱에 위젯이 있어도 위젯을 모아놓은 페이지에서만 볼 수 있게 해 그렇게 편하지만은 않았다. 하지만 iPadOS 13에 처음 등장한 홈 위젯이 아이폰에 적용되면 그것만으로도 새로운 스마트폰을 쓰는 느낌을 줄 것으로 기대된다.  특별한 형태의 QR코드를 읽는 AR 앱도 발견됐다. 기존과 달리 둥근 원형으로 제작된 바코드로 애플 뮤직이나 아이튠즈 스토어에 있는 콘텐츠와 오프라인 매장의 쿠폰 등을 읽는 역할을 할 전망이다. 자신의 애플 기기를 찾는 파인드 마이(Find My) 앱도 신규로 추가돼 새로운 기능을 선보일 계획이다.  새로운 QR코드로 알려진 이미지       @ Josh Constine  스타일러스 펜인 애플 펜슬과의 연동도 더 강력해질 것으로 보인다. 이 부분이 아이패드를 넘어 새 아이폰까지 지원하게 될지는 아직 전망이 엇갈리지만 사파리와 다른 인터넷 브라우저에서도 애플 펜슬로 그리기 등 마크업 기능을 사용할 수 있도록 개발 중으로 전해진다.  인공지능 비서 시리의 역할도 추가돼 사파리에서 번역을 바로 지원할 계획이다. 시리는 이미 문장의 의미와 단어 번역을 할 수 있는 상태로 이를 전체 iOS 시스템으로 확장 적용하는 것으로 보인다.  많은 아이폰 사용자가 바라던 통화 녹음 기능의 탑재 여부도 기대를 모으고 있다. 통화 녹음이 안된다는 점은 안드로이드폰 사용자 혹은 이 기능이 반드시 필요한 사람들이 아이폰 사용을 꺼려 하는 가장 큰 이유 중 하나다.  유출된 초기 iOS14 버전 내부 설정 이미지  여러 IT 분석가들이 미리 본 iOS 14 초기 내부 빌드에는 통화 녹음 기능이 존재했다. 이 때문에 각 국가의 통화 녹음 관련 법적 허용 수준에 따라 애플워치의 심전도 측정 기능(ECG)와 같이 지역에 따라 사용할 수 있을 것이란 관측이 나왔다. 하지만 일각에서는 애플 내부 분석을 위한 디버깅 목적으로만 사용하는 기능이라는 얘기도 있어 실제 탑재 여부는 베타 버전이 공개돼야 알 수 있을 것으로 보인다.  새로운 iOS 14는 기존 iOS 13을 사용하던 모든 아이폰에 설치될 것으로 알려졌다. 이것이 사실이라면 지난 2015년 출시했던 아이폰 6S까지 신규 OS 설치가 가능하다.    '애플페이' 이번에는 좀 열어 주면 안 될까  새로운 기능이나 이미 존재하지만 국내에서 사용할 수 없는 애플 서비스 중 아이폰 사용자가 애타게 기다리는 것들이 있다. 새로운 발표가 있을 때마다 많은 사람들의 기대를 모았지만 번번이 허탕이었다.  삼성 갤럭시 유저에게 물어보면 모두가 이구동성으로 말하는 것이 있다. 삼성페이가 너무 편하다는 것이다. 지갑을 들고 다녀야 하는 이유를 전혀 모를 정도라고 한다. 아이폰도 애플페이라는 결제 시스템이 있지만 국내에서는 쓸 수 없다. 아마도 가장 많은 사용자가 국내에서 열리길 바라는 기능일 것이다.   최근 많은 아이폰 사용자들의 '행복 회로'를 돌리게 만들었던 소문이 있었다. 현대카드가 애플페이 전용 카드를 낼 수 있다는 것이었다. 미국의 애플 카드와 비슷한 캐시백 혜택을 주던 제로카드가 단종되고 새로운 카드가 애플페이를 쓸 수 있게 된다는 추측이었지만 뚜껑을 열어본 결과 아니었다. 현대카드는 새로운 형태로 리뉴얼된 제로카드 상품을 출시했다.  애플페이가 국내에서 상용화 안되는 가장 큰 걸림돌은 신용카드 수수료율 문제라는 것을 대부분 사용자도 알고 있지만 그래도 언젠가는 들어오겠지 오매불망 기다리는 기능이다. 이 부분이 해결되면 아이폰을 찍고 지하철과 버스에 오르는 일도 그리 먼 미래는 아닐 것으로 기대된다.   혹시 아직도 아이튠즈 스토어를 기다리는 사용자가 있다면 이제 포기할 때가 된 것 같다. 앱스토어, 원화 결제, 애플 뮤직이 모두 열렸지만 아직도 국내에는 없는 것이 음악과 영화 등을 살 수 있는 애플의 아이튠즈 스토어다.  아이튠즈 스토어가 이제 와 열릴 가능성은 애플 페이보다도 희박하다는 것이 업계 의견이다. 반쪽짜리() 국내 애플 뮤직에서도 봤듯이 콘텐츠 판매를 한곳에 모은다는 것은 복잡한 이해관계가 얽힌 어려운 일이다. 각 저작권 업체와 협의가 필요하다. 시대의 흐름도 이미 스트리밍으로 넘어가고 있어 아이튠즈 스토어를 이제 와 국내에 오픈할 이유가 더 없어지는 중이다.    새로운 기기 발표도 있나  이번 WWDC에서는 새로운 기기 발표도 있을 것이란 추측이 많다. iOS 14에 들어갈 신규 앱 파인드 마이와 연동될 '에어 태그(Air Tag)'가 우선 유력하다. 자신의 소지품에 부착하는 형태로 연동된 아이폰과 멀어지면 소리가 나거나 분실된 물건을 찾을 수 있게 할 제품이다.  에어 태그 가상 이미지 목업  애플이 준비 중으로 알려진 '에어팟 스튜디오'도 출시 가능하다. 오버 이어 헤드폰 제품으로 강력한 노이즈 캔슬링 기능을 가진 무선 제품으로 알려졌다. 에어팟이 귀에서 떼면 재생이 멈추는 것과 같이 헤드폰을 목에 걸면 자동으로 제품 전원이 꺼지는 것으로 알려졌다.  이 밖에도 새로운 아이맥 등 올해 출시될 것으로 알려진 모든 신제품이 발표 후보다. 하지만 올해 초 코로나19(신종 코로나 바이러스) 사태가 생산과 개발에 영향을 미친 것으로 알려져 발표 일정이 미뤄질 가능성도 있다.   WWDC는 코로나19로 인해 사상 최초로 온라인으로 개최된다. 첫날인 22일(현지시간) 팀 쿡 애플 CEO의 기조 연설을 시작으로 26일까지 열린다. 앱 개발자들과 애플 엔지니어가 주축이 되어 100여 개 세션과 1:1 개발자 랩 등이 화상회의와 동영상으로 진행된다.  테크플러스 에디터 김창욱 tech-plus@naver.com  이거 하나만 있으면 끝 워치+이어폰 '웨어버즈' 혁신적인 아이디어 제품이 올라오는 크라우드 펀딩 사이트 킥스타터에 지난 2019년 여름 한 제품이 등장했... m.blog.naver.com   *테크플러스 텔레그램 구독하기* ""]"
2020-06-01,애플페이 한국 출시?,https://blog.naver.com/love01th/221987050804,"[' ‘애플페이’ 한국 출시설  지난 2014년 애플페이가 첫선을 보인 이후 매년 애플페이 국내 도입설이 나오고 있다  최근엔 현대카드가 단독으로 애플페이를 도입할 것이라는 이야기도 나왔다  현대카드 ‘제로(ZERO)’의 단종 소식을 두고 애플페이 기반의 신용카드인 ‘애플카드’를 도입하기 위한 사전작업이라는 소문이 돌았다  결국 제로카드 리뉴얼을 위한 것으로 애플카드와는 전혀 상관이 없는 것으로 확인  그만큼 국내에서도 애플페이 도입에 대한 기대감이 높다는 것을 보여줬다  한국 사용자들이 애플페이 못 쓰는 2가지 이유  전 세계적으로는 비접촉식 모바일 간편 결제의 강자는 애플페이다  당연하게도 애플페이가 출시된 다음 해인 2015년부터 국내 서비스 도입을 놓고 국내 애플과 카드사들의 논의가 이어졌으나 지금까지 합의를 못하고있다.  이유는 크게 결제 수수료와 전용 단말기 도입관련 비용 부담 두 가지다  애플은 애플페이의 무카드거래(CNP) 건에 대한 수수료를 국내 카드사로부터 받아야 한다는 입장  플라스틱 카드로 결제하는 게 아니라 아이폰을 플랫폼으로 인증을 거쳐 결제가 되는 만큼 그에 대한 비용을 지불해야 한다는 입장이다  문제는 애플이 요구한 수수료율(약 1%)이 너무 높다 카드사의 일반적인 결제 수수료율(2% 안팎)의 절반  애플페이가 이미 도입된 다른 나라에 비해서도 최소 2배 이상 높은 수수료이다  국내에서 많이 쓰이는 삼성페이가 카드사에는 따로 수수료를 요구하지 않는 것과 비교하면 더욱 대비된다  사용자가 삼성페이를 쓸 경우 결제 과정에서 지문·홍체인식 등에 따른 생체인증 수수료가 건당 510원 정도 발생하는데 이는 카드사에서 부담한다  그나마도 삼성페이가 아니라 모바일 인증업체가 가져가는 구조다   바로 애플페이 결제에 필요한 근거리 무선통신(NFC) 단말기이다  국내 모바일 결제시장을 양분하고 있는 마그네틱 전송(MST) 방식과 바코드·QR코드 결제 방식과는  달리 NFC방식은 전용 단말기가 필요하다  애플은 이 전용 단말기 역시 국내 카드사가 직접 보급해야 한다는 입장이다  애플페이를 국내에서 사용하려면 비자, 마스터카드 등 해외브랜드와 제휴해야 한다.  비자의 결제 수수료는 1.1%, 마스터카드는 1%다. 이 수수료까지 고려하면 카드사의 부담이 커 애플페이를 도입하기 쉽지 않다는 설명이다  또 NFC 단말기 가격이 개당 평균 15만원 이상이라고 한다  애플페이 이번엔 나올까  카드업계 관계자들에게 들어보면 아직 가능성은 없다  애플페이를 굳이 도입하지 않아도 우리나라 스마트폰 사용자의 80%는 이미 모바일 간편결제 서비스를 사용하고 있다  굳이 카드사의 수익원인 수수료의 절반 가량을 내줘야 하는 애플페이를 도입해야 할 필요성을 크게 느끼지 못할 수밖에 없다  어쨌든 적으나마 국내 카드사들 입장에서는 애플페이(아이폰 사용자들)가 아직 개척되지 않은 새로운 시장이다  카드사가 애플페이를 도입하겠다고 나선다면 제한적이나마 서비스 도입이 가능하다는 전망이다.   신용카드로 NFC 결제가 가능해져서 단말기 문제가 해결되면 수수료 문제는 의외로 쉽게 해결될 것이라는 전망도있다  또 애플이 기존의 입장에서 수수료나 NFC 단말기 비용 부담 등의 조건을 다소 완화할 가능성도 생각해볼 수 있다  구글은 구글페이에 이어 신용카드인 ‘구글카드’를 준비중이다  삼성도 삼성페이 서비스를 부지런히 확대하면서 올 여름 미국 시장에 직불카드형 모바일 간편결제 서비스인 ‘삼성 머니’를 선보인다 [246,840원](▼12%)[Apple Air pods]에어팟2 쿠폰가 $125 애플 에어팟2세대 Apple Airpods 2 / 애플 에어팟 프로 Apple Airpods Pro / 무료배송 / 관부가세 포함 / 한국A/S 가능 믿을 수 없는 쇼핑 찬스 에어팟2 쿠폰가 $125 애플 에어팟2세대 Apple Airpods 2 / 애플 에어팟 프로 Apple Airpods Pro / 무료배송 / 관부가세 포함 / 한국A/S 가능:모바일 기기싱가폴, 일본, 한국, 미국 등 전 세계의 신상품, 최신 트렌드 및 인기 상품을 놀라운 가격에 만나세요 qoo.tn']"
2020-06-01,싱가포르 생활 꿀팁 :: DBS 은행 계좌 만들기 / 애플페이 등록... ,https://blog.naver.com/gamseongtrip5/221995401583,"["" 싱가포르 생활 필수 꿀팁 :: DBS 은행 계좌 만들기 / 애플페이 등록 ( Applepay) & 트랜스퍼와이즈  Trasnferwise 저렴한 원화 해외 송금 가입 싱가포르 생활하면서 알아두면 좋을 꿀팁 방출  DBS 게좌, 오랜 시간이 걸렸지만 아무튼 열었다 DBS를 많이 선택하는 이유는 아마 접근성과 편리함인 것 같다. POSB와 DBS가 같은 ATM을 공유하고 있기 때문이다. 1. 싱가포르 계좌 DBS 은행에서 만들기 코로나 기간이라 일부 지점만 여는 DBS 은행 DBS 인터넷으로 계좌 신청을 5번 했으나, 메일도 문자도 오지 않는 그대여 - 점심 먹을 시간 아껴서 집 근처 지점에서 가서 만들고 온 DBS 계좌 이야기이다.  싱가포르에서 DBS 계좌를 만들기 위해 필요한 서류는 1) 회사 증명서 (반드시 집주소가 적혀있어야합니다) : 첫번째 서류에서 집주소 증명이 어려워 돌아갈뻔한 슬픈 소식이. 2) 싱가포르 비자 증명서 ( IPA 레터도 유일하게 받아주는 은행입니다) 3) 여권  일반적으로 외국인은 DBS Multiplier Account 계좌에 가입하게 된다. 평균 3000불이 들어가있어야하고, 3000불이 채워지지 못할 시 5불이 수수료로 지불된다. 또한 6개월 이내에 싱가포르를 귀국하게 되어 은행 계좌를 닫게되면 30 달러를 수술로 내야한다. 인터넷으로 온라인 가입하면, 얼마가 보관되어있든지 수수료가 안든다는데, 나처럼 실패할 확률이 높아, 마음 편하게 지점 다녀오는게 편할 듯 하다.  이렇게 하면 계좌가 바로 발급 완료 계좌는 Debit 카드와 함께 발급해준다. Debit 카드에는 교통카드 기능도 있어서 편리할 듯 하다 2. 싱가포르 애플페이 등록하기 / Apple pay 가입하기 한국은 아직 애플페이가 없으니, 애플페이를 쓸 기회가 없었다. 그래서 싱가포르에서 계좌를 만들면 제일 먼저 하고 싶었던 일이 애플페이 등록하는 일이었다 퇴근 후 애플페이 등록방법 찾아보기  애플페이 등록은 간단하다. 아이폰에 Wallet 계정에 들어가 등록하면 되는데, 싱가포르 은행 DBS, OCBC, UOB 모두 가능하다. 다만 애플페이를 설정하기 전에 제일 먼저 해야하는 일이 이는데, 바로 지역을 Singapore로 설정하는 일이다. 방법은 간단하다. 설정 > 일반 > 언어 및 국가 > 국가를 싱가포르로 설정 (왼쪽 사진 참고) 여기까지 했다면 반은 성공한 것이다 다음 Wallet을 들어가 애플페이를 클릭한다. 그 다음 카드를 등록하면되는데, 카메라로 카드 인식도 가능하다 :) 카드정보를 입력후 문자로 전송되는 Verification code 를 입력하면 끝 나의 경우, 애플워치에서 애플페이 켜보는 게 소원이었으므로, 바로 애플워치에서 애플페이 옵션 설정하기 다만 애플페이를 애플와치에서 활성화시키기 위해서는, 와치의 passcode 설정이 필수이다. 이렇게 설정이 완료되었다면 Wallet에 들어가 위에 등록한 카드를 클릭하면 애플페이를 사용할 수 있고, 리더기에 대면 결제 끝 싱가포르는 Apple pay 로고가 있거나 교통카드로도 사용이 가능하다. MRT랑 버스에서 결제가 가능하다는 사실  카드도 여러개 설정이 가능하니 싱가포르 생활에 좋은 꿀팁이 될 수 있을 듯  이 Wallet에는 좌측 사진처럼, 항공권 등 다양한 바우처도 저장이 가능하다 3. 싱가포르에서 한화를 송금하는 가장 저렴한 방법 : 트랜스퍼와이즈 Transfer wise 싱가포르에서 한국으로 소액을 송금해야하는 경우가 있다면 정말 좋은 서비스이다. 작년에 영국 핀테크 관련 기사를 읽으면 늘 나왔던 트랜스퍼와이즈 서비스  언젠간 써보고 싶었는데 이렇게 싱가포르 와서 써보는구나 아마 환율보며 송금하는 사람도 있을테고, 한국에 일이 있어 송금하는 사람도 있을 거다  송금 방법도 매우 간단하다. 트랜스퍼와이즈 웹사이트 들어가기 이 추천인 코드를 사용하면 그냥 들어가 가입하는 것보다 훨씬 더 좋은 조건으로 이용이 가능하다. 900SGD 까지 최초 송금 수수료가 무료 이걸 모르고, 나는 그냥 가입했다가 첫 송금부터 1000불당 11불을 낼 예정... () Transfer Money Online | Send Money Abroad with TransferWise - Sign up Yeseul has given you a fee-free transfer of up to 900 SGD. You can always transfer more, but we'll waive the fee on the first 900 SGD . Personal Business Country of residence United Kingdom Claim your fee-free transfer Or, continue with Apple , Google or Facebook transferwise.com 개인과 사업자로 나눠서 가입이 가능한데, 나는 Saving 목적이므로 개인으로 가입했다. 트랜스퍼와이즈의 경우 개인은 1회당 송금이 한화95만원 정도까지 가능하다. 1년에는 30000 미국 달러로 제한되어있다 이렇게 간단히 아이디/비밀번호를 설정하고 들어가면, 본인 인증 단계가 나온다. 나의 경우 한국 여권의 앞면으로 등록했고 10분도 안되어서 서류 승인이 되었다는 메일을 받았다 :)  트랜스퍼와이즈에서 돈을 보낼 경우 Send money를 클릭 한후, 통화를 설정하고 받는 이를 설정하면 된다 나에게 보낼 경우, Add a recipient > Myself 클릭하고 한국의 계좌 수신인/정보를 입력하면 된다.  오른쪽 사진은, 트랜스퍼와이즈에서 제공하는 서비스로, 다른 은행을 이용했을 때보다 얼마나 저렴한지를 직관적으로 보여주는 서비스이다. 마지막으로 결제단계만 선택하면 송금이 끝난다 :)보통 하루 길어야 이틀 정도면 되는 것 같다 - 개인 해외 송금을 목적으로 이용하기에는 좋은 서비스인 것 같아 추천 그 외에 싱가포르 생활하면서 도움이 되었던 내용들은 또 정리해보겠다 :)""]"
2020-06-01,애플워치5 - 애플페이로 결제하기,https://blog.naver.com/ellas_universum/222015268559,"["" 아이폰으로 갈아타고 심심찮게 꽤 잘 쓰고 있는 기능이 바로 애플페이 입니다. 현재 한국에서는 서비스 하지 않고 있는데요, 이런 점들을 보면 한국에서의 편리성은 누가뭐래도 갤럭시가 단연 으뜸인 것 같습니다. 비싼 스마트폰 샀는데 페이도 안되고, 기본으로 탑재된 기능도 쓸 수 없다면... 핸드폰 가격이라도 싸게 줘야지 그게 아니라면 소비자를 우습게보는 거죠. 사실 반대로 독일에서는 삼성페이가 안됩니다 . 개인적으로, 유럽이나 미국에서 스마트폰을 100% 활용하려면 애플이, 한국에서는 삼성이 더 적합한 것 같아요.  ***  애플워치5 + 애플페이로 결제하기   아이폰 Wallet월렛에 카드를 등록 해놓으면 애플워치 동기화 시, 같은 카드를 추가 할 것인지 묻습니다. 원하는대로 자유롭게 추가하거나 삭제할 수 있어요. 저는 워치에는 카드 1개만 등록시켜놓았습니다. 핸드폰보다 상대적으로 결제하기가 쉽기 때문에 소비를 조절하고자 하는 의도입니다.    결제 순서는 매우 간단합니다. 먼저 워치에 있는 월렛을 작동시킵니다.     그러면 아래와 같은 결제페이지가 뜨는데 전원버튼을 이중클릭합니다. 아이폰에서 앱 다운받을 때 처럼 두번 클릭.     '준비됨'이라는 문자가 뜨면 워치를 그냥 카드 리더기 가까이 가져다 대기만 하면 됩니다.    이렇게요. * 가맹점에 '애플페이'표시가 따로 없어도 와이파이같은 표시가 된 카드 터치식 리더기가 있다면 모두 사용 가능합니다. 애플워치로 결제하는 모습 (사진출처: chip.de)   아직 독일도 애플페이가 익숙하지 않아서 종종 가맹점에 애플페이 되냐고 물어보면 '잘 모른다'고 하는 곳이 많은데, 카드 리더기가 있고 통용되는 카드만 등록 되있다면 모두 가능하니 간편하게 워치만 갖다대면 끝납니다.  아이폰 애플페이도 편한데 워치로 하니 정말 세상편하게 결제가 됩니다. 특히 손에 이것저것 들고 있거나 장 볼때 지갑 꺼내랴, 카드 챙기랴, 사인하랴 정신이 없는데 손목만 움직여서 몇 가지 과정이 생략되니 참 편하네요. 다만 결제과정 자체가 너무 쉽고 편하므로 신용카드나 고액이 있는 카드를 등록하는 건 개인적으로 비추천합니다.  결제방식이 스마트 해질수록 소비방식은 점점 더 쉬워져 서 통장 잔고는 스마트해지지 않는 것 같습니다. 결국 소비자 스스로 똑똑해지는 수 밖에 없겠죠.   ""]"
2020-06-01,"슬기로운 호주생활, 호주 애플 페이 사용법",https://blog.naver.com/ozcareerau/222002507908,"["" 여러분 안녕하세요 호주 취업 전문, 오즈커리어의 Dean입니다  혹시 호주에서 생활하고 계신 여러분들, 아이폰이나 애플 워치를 쓰고 계신가요 쓰고 계시다면, 혹시 '애플 페이'는 사용해보셨나요  호주 생활에서 이 편리한 '애플 페이'를 아직 안 써보셨다면 여기를 주목해주세요 호주 생활 정보, 애플 페이 사용 방법, 짜잔  슬기로운 호주생활, 애플페이 사용방법  호주 생활 정보, 호주 애플 페이 사용 방법  애플페이란 Apple에서 지원하는 간편 결제 시스템 으로 아이폰, 애플워치와 같은 Apple 기기를 이용하여 온라인, 오프라인 결제가 가능한 시스템이다. 전세계 약 40여개의 국가에서 3억명 이상이 사용중이며 애플 페이의 편의성으로 나날이 사용층이 넓어지고 있다.   호주 애플 페이 사용 로고   호주에서는 결제할 때, 현금, 카드를 직접 내는 것보다 아이폰, 애플 워치로 간단하게 결제를 하는 경우를 생각보다 많이 볼 수 있는데요. 바로 이 애플 페이 시스템 덕분이랍니다.   호주 애플 페이 사용 로고 위의 표시가 있다면 어디에서든지 애플 페이를 사용할 수 있어요. 사용하려면 등록을 해야겠죠  애플 페이 등록하기 1. 아이폰에서 Wallet 어플 실행하기 호주 생활 정보, 호주 애플 페이 등록하기 * Wallet 어플이 없다면 설정 > 일반 > 언어 및 지역 에서 지역을 '오스트레일리아'로 바꿔주세요  2. 우측 상단에 + 버튼 클릭하기  호주 생활 정보, 호주 애플 페이 등록하기  3. 카드 추가하기  호주 생활 정보, 호주 애플 페이 등록하기  4. 약관 동의 & 인증번호 확인하기  5. 완료 호주 생활 정보, 호주 애플 페이 등록하기   정말 간단하죠 절차대로 간단하게 등록하면 호주 생활 시 애플 페이 이용이 가능합니다.  호주 애플 페이를 지원하는 은행들 호주 생활 정보, 호주 애플 페이 이용방법 호주의 대부분의 은행들이 애플페이 지원 을 하고 있기에 아이폰이 있는 여러분들이라면 고민하지 마시고 한 번씩 사용해보시기를 추천해드릴게요  애플 페이를 사용하려면 다음과 같은 장점이 있답니다.  애플 페이 사용 장점 1. 카드 없이 결제 가능 (아이폰, 애플 워치) 2. 카드 없이 ATM 이용 가능 3. 카드 없이 교통카드 이용 가능 4. 카드 없이 온라인 결제 가능 5. 멘버십, 항공권 등 전부 Wallet 어플을 통해 관리 가능  제가 카페에서 일을 햇을 때 애플 페이로 결제하시는 분들이 상당히 많았었는데 굉장히 편리해보여서 저도 참 잘 쓰고 있는데요.  아이폰 사용자인 여러분들도 호주에서 애플 페이 한 번 써보세요. 강력 추천 드립니다 오늘의 호주 생활 정보는 여기까지  오즈커리어는 호주 취업 전문 컨설팅 그룹으로 호주에서 글로벌 커리어 업을 목표로 하시는 여러분들의 꿈을 응원하고 있습니다. 단기 호주취업 비자 - 호주 요리사 및 호주호텔 취업 Q&A (407 트레이닝 비자) 안녕하세요, 오즈커리어 취업팀의 Tei 입니다.요리 및 호텔학교를 갓 졸업하시는 많은 학생분들께서 지... blog.naver.com  ""]"
