post_dates,title,url,full_text
2020-05-01,[호주정보] 호주에서 간편하게 애플페이 사용하기!,https://blog.naver.com/vof93/221937687278,"[' 안녕하세요. 시드니 빨간지붕 입니다 :-) 오늘은 편리한 생활을 책임져줄 애플페이를 소개해 드릴게요  애플페이가 현재 한국에서는 아직 도입이 되지 않고 있지만, 해외, 호주에서는 가능하답니다 그럼 애플페이 등록방법과 사용방법에 대해 알아볼게요   https://www.apple.com/au/apple-pay/  애플페이란 애플페이는 애플사에서 출시한 NFC(근거리 무선통신)을 이용한 모바일 결제 시스템입니다. 따라서 아이폰 유저들만 이용이 가능한 서비스입니다. 한국에서는 삼성페이가 대중화 되어있고 애플페이는 현재 사용이 불가능한데요, 호주에서는 애플페이와 삼성페이 두가지 서비스를 모두 사용하실 수 있습니다. (삼성페이는 국가 지역별 컨트리락이 걸려있기 때문에 호주에서 구입한 삼성 기기에서만 서비스가 지원됩니다.) 애플페이는 삼성페이와 달리 한국에서 가져온 아이폰 기기로도 서비스 이용이 가능합니다 그럼, 애플페이의 장점과 등록/사용방법에 대해 자세히 알아볼까요  애플페이의 장점 https://www.apple.com/au/apple-pay/   실물 카드 없이 핸드폰만으로 결제가 가능합니다.  카드 없이 ATM기 이용이 가능합니다.  별도의 수수료가 없습니다.  교통카드로도 이용이 가능합니다.  애플워치를 활용하여 결제가 가능합니다.  온라인 결제시에도 간단하게 애플페이로 결제가 가능합니다.   애플페이 등록하기  1. wallet 앱 실행  먼저 내 아이폰에서 wallet 앱이 보지지 않을 경우 먼저, 설정에서 국가 설정을 대한민국 → 오스트레일리아로 변경 해주세요 설정 → 일반 → 언어 및 지역 순으로 들어가시면 됩니다.  2. 카드 등록 wallet 앱 실행 후 우측 상단에 + 버튼을 클릭 하셔서 카드를 추가하세요   카드를 촬영하여 사진으로 등록 이 가능하고, 또는 카드번호를 입력하여 추가 하시면 됩니다. 약관동의 및 인증번호 확인 → 등록완료 카드 등록을 완료하면 등록한 카드사에서 이메일로 애플페이 등록이 완료 되었다는 메일이 옵니다.   애플페이 카드 등록에 관련한 카드 추가, 카드 삭제, 거래 내역 확인은 wallet 앱에서 모두 확인이 가능합니다. 또한 Wallet 앱은 학생ID카드, 항공권, 숙소 예약권, 콘서트 티켓 등 울월스 멤버십 카드도 한꺼번에 관리가 가능 한 어플입니다. 평소에 자주 사용하는 멤버십 카드들을 등록해서 사용하시면 매번 실물카드를 들고다니지 않아도 돼서 정말 편리하게 이용하실 수 있어요 :-)  3. 완료 후 결제 방법    먼저, 카드 단말기 화면에 상단의 이미지가 확인되면 홈버튼이 있는 아이폰의 경우 홈버튼을 이중 클릭 하세요. 홈버튼이 없는 아이폰 X이상 경우 측면 버튼을 이중 클릭 하세요. 카드 화면이 나타나면, Face ID를 사용하시거나 암호, 또는 지문스캔을 통해 인증을 하세요. (설정가능)   화면에 완료와 체크표시가 나타날 때까지 아이폰의 상단을 비접촉식 리더기의 가까이 두세요. 완료가 됐을 경우에 리더기에서 삐-하는 소리가 납니다. (간혹 아이폰에서는 완료라고 뜨지만 결제가 안된 경우도 있으니 단말기 화면을 확인해 주세요.)   애플페이 이용 가능 은행  저도 호주에 온 이후로 애플페이를 사용하고 있는데요, 지갑에 무겁게 카드들을 들고 다니지 않아도 돼서 너무 편리하게 이용중인 서비스에요 :-) 트레인 탈때도 오팔대신 핸드폰으로 찍고 들어갈 수 있어서 너무 편리하답니다 그럼 더 유용한 정보로 다시 찾아뵐게요   ']"
2020-04-01,영국 생활을 편리하게 해주는 애플 페이 등록 & 사용,https://blog.naver.com/inthesunj/221894832441,"[' 영국에서 Apple Pay 사용하기 중국에서 위챗페이나 알리페이를 쓰며 지갑 없이 편리하게 생활하다가 영국에 오고 나서 카드 결제를 해야 해서 아쉬웠어요.  남편은 삼성폰을 써서 구글 페이를 쓰는데 외출했을 때 지갑이 없어도 결제할 수 있어서 자주 이용하더라고요. 남편과 다닐 때 지갑을 들고 다니지 않아 부득이하게 남편이 돈을 내는 경우가 많았어요. 그래서 그런지 제가 은행 카드를 만들자 남편이 애플 페이를 공부해서 제 휴대폰에 등록해 줬어요.   영국 생활을 더 편리하게 해주는 애플 페이 같이 등록해볼까요  아주 쉬운 애플 페이 등록 지웠다가 다시 등록한 경우 일단 Wallet 앱에 들어갑니다. 지갑에 들어가서 오른쪽 위에 +를 클릭하거나 밑에 ADD를 눌러요. 만약에 + 모양이 나타나지 않으면 지역을 변경해야 돼요. 설정에 들어가서 언어 & 지역을 클릭하고 지역을 영국으로 변경해 줍니다. 아까 Wallet에서 +나 ADD를 누르면 이 화면이 뜨는데 Continue를 눌러요. 저는 애플 페이 쓰다가 잠시 지웠다가 다시 등록하는 거라 정보가 이미 들어있었어요. 이런 화면이 뜨면 잘 읽어보고 Agree를 눌러줍니다. 문자나 이메일을 선택해서 본인 확인을 할 수 있어요. 저는 문자를 선택했더니 바로 문자 메시지가 왔어요. 30분 이내로 문자로 받은 숫자를 입력하면 돼요. 그럼 등록한 카드가 활성화돼서 애플 페이를 사용할 수 있어요.  추가로 카드 새로 등록 네모 틀 안에 카드를 비추면 정보가 자동으로 입력돼요. 스크린샷을 했더니 개인 정보 때문인지 카드 모양을 보여주지는 않네요. (네모 틀도 제가 만들었어요. ) 그럼 이름이랑 카드 번호가 자동으로 입력돼요. 그런 다음 카드 정보를 추가 입력하면 본인 확인으로 넘어가요. 이번에도 문자를 선택해서 숫자를 입력하면 끝 아주 쉽쥬 본인 확인이 끝나면 이 카드를 Default Card로 사용할 것인지 물어봐요. Default Card는 메인으로 사용하는 카드를 뜻해요. 애플 페이에 두 카드를 등록하니 Wallet 화면이 이렇게 바뀌었어요. 영국 애플 페이 사용 돈을 지불할 때 애플 페이를 열어서 카드 단말기 가까이에 휴대폰을 대면 이런 화면이 떠요. 그러면 지문으로 인증하면 끝이에요.  지문 인증할 때 휴대폰을 단말기에서 떼버리면 지불이 안될 수도 있으니 단말기 가까이에 놓고 지불하세요. 예전에 캡처를 미리 해둔 사진이에요. 영국 은행은 거래 내역을 바로바로 보여주지 않아 답답한데 애플 페이를 쓰면 어디에 얼마 썼는지 바로바로 떠서 좋아요.  상점이나 레스토랑에서 애플 페이를 사용할 수 있는지 미리 확인하면 좋아요. 웬만하면 마트에서는 사용이 가능한 것 같아요.  이 밖에도 런던에서 지하철, 버스 탈 때나 온라인 쇼핑할 때도 애플 페이를 사용할 수 있어요.  영국에서 생활하시는 분이라면 애플 페이 써보시는 걸 추천합니다   ']"
2020-04-01,"D+30 스시,나나스그린티,아이폰에 스이카 등록하기(애플페이)",https://blog.naver.com/jinny990226/221923077437,"[' 2020.04.01(수) 셰하 1층에 누군가 새로 적어놓음. 어제 먹고 싶었던 스시 오늘 먹는다 친구가 알바하는 곳 스시집 갔다 (히히 직원할인 개이득) Tsukiji Gin Itcho 1 Chome-10-13 Koishikawa, Bunkyo City, Tokyo 112-0002 03-3814-5557 https://goo.gl/maps/Spm7fKRZQfp1kEqt9 포장도 가능 평일 런치 580엔 혜자,,, (근데 이거 먹고 배 안 차서 무조건 추가주문) 사진 찍는 거 못 참고 몇개 먹어버림 이것저것 겁나 시켰다. 친구가 맛있다고 했지만 큰 기대 안 하고 갔었다. 근데 진짜 맛있었다. 스시가 반질반질하고 가성비 좋음.  각자 낼 줄 알고 난 막 시켰는데 친구가 사줌 고마워…정말 최고의 스시였어….  디저트는 내가 캐리하기로 함  조금 걸어서 도쿄돔시티에 나나스그린티 카페 갔다. 오설록 느낌 나나스그린티 메뉴. 밥도 판다. 나는 말차시로타마플로트라떼 친구는 호지차생초콜릿파르페 둘 다 맛없없. 호지차파르페도 존맛 다음엔 호지차메뉴도 먹으러 또 올거다 시로타마라고 팥죽에 넣는 옹심이새알심 같은 게 들어있다.   난 아이폰유저지만 스이카 넣어서 쓸 생각 안하고 있었다. ‘라인페이가 있는데 굳이..’  …하지만 항상 변수가 있다 라인페이가 안되는 곳도 있다는거 +근데 스이카 결제는 되는 곳..  기왕 1년 살건데 ‘애플페이 함 해보자’ 마음 먹고 집 와서 등록했다. https://blog.naver.com/jinny990226/221923079927 일본/도쿄워홀 D+32 아이폰 모바일 스이카 발급 방법(Apple Pay,Wallet,애플페이 오류) 2020.04.03(금)오늘은 한 게 없으니 특별편.(제가 혼자서 했던 방법이에요참고가 되길 바랍니다*ଘ(੭*... blog.naver.com 우여곡절 끝에 등록한 스이카. 아직 한번도 안 썼다  요거트에 딸기시리얼 먹고 하메가 준 젤리 먹고 잠   희진도쿄워홀  ヒジン東京ワーホリ  도쿄워홀 일본워홀 도쿄워킹홀리데이 일본워킹홀리데이 도쿄생활 도쿄코로나 나나스그린티 아이폰스이카 모바일스이카']"
2020-05-01,/ 평화로운 맨션 / 사쿠라다 도리 / 애플페이 스이카 등록!,https://blog.naver.com/01032007052/221940386452,['  어제 오픈 할 것 같다고 했는데...... 우리 매장은 비상사태선언이 연장되면 (4일발표 예정이라고 한다) 휴업계속 될거라는 이야기........ OMG       밖에 나가는데 102호방 문앞에 뭐가 붙어있길래 봤더니  무섭다........... 103호는 조용한 남자가 살아서 아닌 것 같고 101호 사는 분이 붙였을 것 같은데  너무 웃김   우리집에도 저런거 붙을까봐 넘 무섭  우린 둘이사니까 항상 떠들 수 밖에 없으니..... 옆집분께 항상 넘 죄송......  끝방살아서 정말 다행이고 1층살아서 다행이야 정말루 (맨날 물건 떨굼)  종이 안붙게 조용히 살아야지    점심엔 꼬깔콘이랑 초코파이랑 커스타드랑 볶음밥이랑 밀크티 마셨...... (밥을 먹어라)      저녁으로 쫄면과 소고기 쫄면은 장터에서 샀는데 3분30초 삶으래서 했는데 좀 덜 익은느낌.......겁나 탱탱함  원래 면이 그런건지 내가 너무 덜 익혔는지 쿄쿄쿄쿄코쿄  소고기는 버터에 구워 소금후추를 뿌렸다 すごかった...................   내일 뭐먹지........       사쿠라다 도리.   굿모닝콜에서 처음 보고 여주가 즛또 짝사랑하는데 (맞나.... ) 이해가 안갔음......정말루  근데 어제 유튜브헤엄치다가 커피&바닐라 짤 보버렸는데..... 세상에...... 커피&바닐라 영상은 못찾고 퍼펙트크라임 이랑 쓰레기의 본망을 봄.......... 무자막으로............ 의지가 대단했음............. 보통은 일어자막이라도 나오니까 보는데 무자막은 못봄.......  카카후카카 이후 처음    그가.... 잘생겨보인다.... 아니...... 잘생겼다....................  오늘..... 그가 나오는 오렌지를.... 앞으로 너의췌장과 커피&바닐라도 볼 예정........   별개지만 오늘밤 안아도 될까요랑 꽃에게 짐승 넘 보고싶다.......      라푼젤 볼려고 운동 빨리하고 옴 담주는 토이스토리3   포고 레이드하러 멀리까지 다녀옴....... 밴드로는 5.89km였는데........... 나이키 너어어어어어어어어어어어   오늘 겹살사장님이 케익가져가라고 하셔서 간만에 와자와자 네리마까지 다녀옴  케익먹겠다고      오늘 엄청 더웠는데 내일은 더 더워진다고 한다 벌써 여름이 오는구나....... 나도 밖에 나가서 놀고 싶다@  내일부터 다시 5렌킨 시작 간바레       애플페이에 스이카 넣었다 보증금도 포함된 금액으로 넣어져서 카드는 폐기처분 근데 겁나 안끊어짐    왕신기    근데 애플페이는 신용카드만 등록이 가능..... 체크카드 안됨....... 그래서 스이카어플을 따로 다운받아서 거기서 충전해서 써야한다      스이카어플에서는  비자(smbc) / jcb(라인페이) 둘다 카드등록 가능   얼른 써보고싶운데 나갈 일이 없네 ']
2020-04-01,"삼성페이와 애플페이, 두개 다 편할까",https://blog.naver.com/dsjshome/221926826460,"[' 페이 서비스가 요새 여러 종류로 많이 늘어났다고 생각해요. 네이버는 네이버페이가 있고 안드로이드 갤럭시 시리즈 폰에 삼성페이가 지원되기 때문에 거의 필수적 기능이 됐죠 삼성전자에서 만들었기 때문에 삼성페이라고 불리고 있는데, 국내에서 가장 많이 쓰이는 결제 시스템 중 하나가 아닐까 그런 생각이 들기도 합니다.   스마트폰 시장에서 전 세계를 주름잡고 있는 애플도 마찬가지로 애플페이를 만들어 서비스하는데, 안타깝게도 우리나라에서는 영 현실감이 없는 이야기입니다. 우리나라에는 서비스 되지 않는 항목이기 때문일 것 같아요.   애플페이는 애플과 협약을 맺은 카드사의 카드만 등록되는데, 애플페이에서 요구하고 있는 시스템이 구축된 카드만 사용이 가능하기 때문에 그렇다고 하는 게 이유에요.   삼성페이는 딱히 가맹점에 구애를 받고 있지 않는다는 게 장점 중 하나라고 생각하는데, 카드로 결제가 가능한 곳이라면 사용이 가능하다는 것을 실 사용자 분들께서 이미 알고 계시지 않을까 해요. 그리고 교통카드로도 사용이 가능한 점도 장점이기 때문에 삼성페이가 되는 단말기라면 지갑이 따로 필요없을 정도죠.   애플페이는 수수료도 그렇고 우리나라에서 보기가 어렵기에 삼성페이와 특히 우리나라에서 경쟁구도라고 보기는 어렵지만 과연 수수료나 보안토큰 등 여러 문제들을 뚫고 나서 우리나라에 도입이 된다면 어떤 방향으로 경쟁 구도가 진행이 될 지 궁금합니다.']"
2020-04-01,"애플월렛 활용하기 "" 통일이 먼저일까 애플 페이가 먼저일까.. """,https://blog.naver.com/hoany1214/221889025525,"[' 사실 소비생활을 할 때 멤버십 신경을 많이 안 쓰고 살았습니다.  그런데 주변 지인 또는 가족들의 멤버십 관리를 보니 거시적으로 보면 무시 못 하는구나라는 걸 새삼 체감하고 있습니다.  그래서 저도 멤버십을 적극 활용하기로 했습니다  옛날 같으면 각 지점마다 카드를 발급받고 카드로 적립해야 했지만 시럽, 클립과 같은 통합 멤버십 관리 애플리케이션을 통해 한층 더 편리해진 멤버십 관리가 가능해졌습니다.  다만 편리한 기능을 무료로 제공하는 만큼 멤버십 외 광고 및 각종 기능들이 추가되고 지원되지 않는 멤버십 직관적이지 않은 인터페이스들이 저를 불편하게 하더군요.  좀 더 적극적으로 쉽고 간편하고 간단하고 직관적인 건 없을까.. 고민하다 찾은 플랫폼은 바로.. 애플월렛입니다. 애플월렛 하면 애플 페이를 생각하실 텐데 애플 페이는 애플월렛에 포함된 기능으로 애플월렛이 좀 더 큰 개념으로 생각하시면 편하십니다.  다만 애플월렛인 만큼 안드로이드 사용자분들은 사용하시지 못하는 부분이 애플월렛에 한계입니다.  안드로이드 사용자분들은 삼성페이, 엘지 페이 등 제조사 또는 위와 같은 시럽, 클립 등을 활용하시면 될 것 같습니다 애플월렛에 국내에서 사용 가능한 멤버십을 등록하려면 애플월렛 API를 지원하는 마이 애플월렛과 같은 서비스를 이용하셔야 합니다 무료이며 등록은 그렇게 어렵지 않습니다.  https://www.myapplewallet.com/pass/list 마이애플월렛 새로운 멤버십의 시작 www.myapplewallet.com  -참고- 애플월렛 멤버십은 기존에 발급받은 멤버십 바코드, 번호를 기반으로 동작하기에 기존에 미리 내가 사용하고자 하는 멤버십을 발급받아야 합니다. 따라서 시럽, 클립과 같은 서비스를 통해 바코드, 번호를 발급받으셔야 합니다. 마이 애플월렛을 통해 멤버십을 발급받으면 월렛에 멤버십이 등록됩니다.  해당 화면을 보면 멤버십 카드와 더불어 애플스토어 픽업 카드, 비행기 탑승권을 확인하실 수 있습니다.  애플월렛은 멤버십, 탑승권 각종 서비스를 지원하기에 활용도가 높습니다 오프라인 매장에서 바코드를 제시하여 적립할 수 있습니다. 기존 멤버십을 사용하며 불편했던 부분은 직관적이지 못한 워크플로입니다.  우리가 멤버십을 적립하려고 할 때 물론 준비하고 있으면 되겠지만,  아차 적립해야지 하는 경우가 더 많더군요..  스마트폰을 켜고 어플을 켜고 적립할 멤버십을 찾고.. 이 부분이 제일 불편했던 부분인데  애플월렛은 어떤 작업을 하고 있던 상관없이 측면 전원 버튼 이중 클릭으로 손쉽게 접근할 수 있습니다.  사실 이 부분 때문에 애플월렛을 사용하고 있습니다.  -참고- 측변 전원 버튼 이중 클릭 접근은 애플 페이를 활성화시켜야 가능합니다. 대한민국은 애플 페이를 사용할 수 없는 국가이지만 애플 캐시 카드, 스이카 온라인 등록을 통해 사용이 가능합니다.  애플 캐시, 스이카 등록은 글 마지막 링크를 통해 등록 방법을 알려드리겠습니다 애플 페이 카드를 등록하시면 측면 버튼 이중 클릭 접근 탭이 활성화됩니다.  설정 -> 월렛 및 애플 페이로 들어가셔서 해당 설정을 완료하면 간편하게 애플월렛에 접근할 수 있습니다. 작성하다 보니 조금 어려울 수도 있겠다는 생각이 들기도 하네요. 다만 한 번만 설정하시면 두고두고 편하게 멤버십을 사용하실 수 있으니 아이폰을 사용하신다면 한 번쯤 등록해 보시는 것도 좋을 것 같습니다  티끌 모아 티끌인 세상이지만..  그래도 티끌도 무시할 수 없기에 멤버십을 잘 사용해야겠습니다.  이상 애플월렛 글을 마치겠습니다. 아래 애플 페이 스이카 등록, 애플 페이 캐시 등록 방법 링크를 남겨두겠습니다.  그럼 즐거운 하루 보내세요 애플 페이 스이카 등록 아이폰X 스이카(Suica) 등록 아이폰X의 일본 교통카드 스이카 등록에 대한 안내 입니다.  기존 일본용 아이폰7에서만 등록이 되었던 스이카가 이번에 아이폰8, 아이폰X가 출시되면서 발매국가 제한없이 등록이 가능하게 되었습니다. 참고로 스.. tourmean.com 애플 페이 캐시 등록 [아이폰 웰렛] 애플 페이 캐시 등록하고 편리하게 웰렛 사용하기 기기 : iPhone7, iPhone6sOS : iOS12.1.3 PB2 한국에서는 웰렛에 적립카드 등록, 호텔 예약 등록, ... blog.naver.com ']"
2020-04-01,"페이팔,벤모,애플페이..비접촉 결제 서비스, 코로나로 사용자 증가",https://blog.naver.com/dorothyfever/221912260349,"["" 코로나바이러스로 비접촉 결제 서비스 수요가 크게 증가하고 있다. 미국 재무부는 재난지원금을 은행계좌가 없는 사람들은 페이팔(Paypal),  페이팔의 자회사 모바일 송금결제서비스인  벤모(Venmo), 뱅크오브아메리카와 JP모건체이스 등의 미국 주요 은행들이 소유주인 모바일 결제 서비스 젤(Zelle)와 같은 플랫폼으로도 받을 수 있게 한다고 발표했다.  현금부터 카드까지 타인과의 접촉을 줄이려는 고객들을 위해 애플페이, 구글페이의 사용처도 늘고 있다.  버거킹도 3월부터 미리 앱으로 주문하고 받아가는 드라이브스루 매장 광고에 들어갔고, 월마트는 자체 '월마트 페이'앱으로 고객이 직접 결제하는 서비스 사용울 권장하고 있다.  모바일결제에 관심조차 없던 고객들이 '생존을 위해' 앱으로 주문하고 결제하기 시작했다는 건 주목할 부분이다. 편리하고 경제적인 서비스를 경험해본 고객이 다시 과거로 돌아가지 않을 수도 있을테니..  https://www.thestar.com.my/tech/tech-news/2020/04/16/covid-19-contactless-payments-skyrocket-because-no-one-wants-to-handle-cash Covid-19: Contactless payments skyrocket because no one wants to handle cash As more people worry about catching coronavirus from touching cash and credit-card terminals, a one-time niche technology is roaring into the mainstream. www.thestar.com.my ""]"
