post_dates,title,url,full_text
2020-12-01,"프라다 스몰 사피아노 레더 지갑 (+언박싱, 가격, 구입 정보)",https://blog.naver.com/the_y_universe/222190720834,"[' 프라다 스몰 사피아노 레더 지갑 Prada small saffiano leather wallet 나에게 주는 연말 마지막 큰() 선물 호주 떠나기 전에 지갑을 바꾸고 싶었는데 처음 떠오른 리스트는  1. 호주 특산품 구찌 2. 프라다 3. 생로랑  구찌는 한국과 가격 차이가 큰 제품들이 많아서 호주에서 사가면 더 이득이기는 하지만... 기존에 쓰던 지갑이 구찌여서 고민하다가 매장에 갔는데 마음에 들었던 제품은 재고가 없고, 다음 생로랑은 매장에서 만져보니 가죽 자체와 지갑이 힘이나 각이 안 잡힌 느낌이라 패스.  내 선택은 생로랑 매장 가기 직전 프라다 팔찌랑 보러 갔을 때 마음에 들었던 지갑을 샀다 짜 잔 -  내가 고른 건 카드 지갑과 지갑의 느낌을 동시에 낼 수 있는 신상 지갑 ><  하필 골랐는데 신상이래... 탁월한 내 안목(;)  찾아보니 한국 홈페이지에는 아직 올라오지도 않은 제품 (호주 홈페이지에는 신제품으로 업로드 되어 있다)  색상은 베이비 핑크 컬러의 핑크색도 있었는데 당연히 나는 검정으로 골랐다. 자주 써야하는 물건은 어두운 색인게 마음 편하니까 밖과 안을 합하면 총 9개의 카드 수납이 가능 지갑이니까 지퍼 포켓도 당연히 있고 상단에는 동전 수납이 가능한 지퍼도 있다 사이즈는 손바닥에 쏙 들어오는 크기 몇 년전부터 반지갑이나 작은 지갑만 이용하고, 요즘은 가방도 점점 작아지고 애플 페이, 삼성 페이 등으로 점점 소지품이 작아지는 추세이니까 그런 시대 흐름에 알맞는 사이즈라고 생각한다 :) 오른쪽이 기존에 사용하던 구찌 지갑이고 프라다 지갑이 카드 지갑 형식인 구찌와 사이즈 차이가 크지 않고 오히려 사이드 면을 비교 했을 때 더 얇게 빠졌다 기존 구찌 지갑은 동전 수납 부분이 없는 대신에 안쪽에 넓은 공간에 카드 등을 다 보관할 수 있었는데 이번에 얇은 지갑으로 더 가볍게 다니자 마음 먹은 김에 사용 빈도가 적은 카드 등은 전부 빼버렸다.  이 미니멀 리스트()의 마음 가짐 잘 지켜지길 바란다  보증서 카드도 들어 있고, 구입은 당연히 시드니 웨스트필드 프라다 매장에서 했고 AUD 590 (오늘 환율 기준 492,000원) 한국 홈페이지에는 아직 업로드가 되지 않은 제품이라 가격 정보는 알 수 없다  후에 가격 차이가 얼마가 된다 해도 마음에 쏙 드는 지갑을 찾았으니까 그걸로 대만족']"
2020-12-01,12월 첫째 주 고양이 일상,https://blog.naver.com/double_cheese_/222161576462,[' 고양이들은 중성화 후 다시 넥카라 신세를 졌다. 밤비는 금방 아물어서 5일만에 풀어줬는데 벤츠는 잠깐 풀어준 새 수술 부위 핥아서 피가 쬐끔 남.... 그래서 벤츠만 7일 꽉 채워서 넥카라 씌웠다   그리고 드디어 츄르를 먹였다. 태어나서 처음으로 츄르 먹는 야옹이들 순삭했다 이제 집에 츄르도 쟁여놔야지   밥 먹을 때 잠깐 넥카라 풀어줌 밤비가 옆에 와서 기대길래 감격스러워서 사진 찍었다. 깰까봐 엄청 조심히 찍음  집사들이 수면잠옷 입는 겨울은 고양이들에게 최고의 계절이다. 요새 수면잠옷 입고 다녔더니 무릎에 자주 올라와서 꾹꾹이한다 넥카라 차고 다시 슬픈 고양이 된 벤츠... 슬픈 고양이 벤츠 구경하러 모인 인간들 원래 한 방에 이렇게 잘 안 모이는데 괭이들 오고 나서는 자주 옹기종기 둘러앉는닼 넥카라 차고 이틀정도 완전 우울모드였다. 링웜때가 생각난건가 벤츠... 개빡친...것 같지만 자다 일어나서 그렇답니당 형아 수면잠옷에 꾹꾹이하다 자다 깬 듯 고독한 벤츠 저러다 또 잠... 집사 먹방 보는 벤츠 넥카라 쓴 벤츠는 힘없고.. 화나 보이고... 놀아줘도 조금 놀다가 누워버린다 밥 먹을 때 불편하니까 넥카라 풀어줬는데  그 때마다 한시간씩 그루밍하다가 우다다하다가 다시 넥카라 쓰면 다시 우울모드... 빨리 풀어주고 싶었는데 밤비보다 낫는 속도가 느려서 그럴 수 없었음... 그래도 이제 딱지랑 잘 진 것 같아서 오늘 아침에 둘 다 풀어줬다   오늘도 냉장고 위에서 집안을 감시하는 밤비 오랜만에 소파에 올라간 밤비 사진인 것 같구만 저렇게 앉아서 무슨 생각을 하는걸까 식탁을 아주 효율적으로 쓰는 중이다. 집사들 밥 먹지 않을 때는 고양이 놀이터로 활용 가능   늘어나라 벤츠벤츠 밤비는 벤츠보다 이틀 먼저 넥카라 풀었다. 캣타워 위에 낑겨서 자는 고양이들... 더 큰 무언가를 사줘야 할 것 같다. 초롱초롱 이렇게 이뻐도 되냥 밤비는 모든 수면잠옷을 공평하게 사랑한다. 아이고 이뻐라 행복한 밤비 아 갓벽한 줄 알았던 아이폰에도 단점이 많다. 애플페이 불가 통화녹음 불가 등등... 필수적인 건 아니지만 미세하게 모자라는 게 있는데 요즘 제일 빡치는건 카메라 소리가 너무 크다는거다.. 고양이들 잘 때 조용히 찍고 싶은데 찰칵소리나서 짜증남  절대 개선해 주지 않을거 같아서 더 빡치지만 이미 앱등이가 되버린 이상 쓸 수 밖에 없다   아침먹고 침대 차지한 근엄 밤비 맨날 밤비한테 베개 뺏겨서 요즘은 빨리 베개 차지하기 대결중이다. 거의 고양이가 이기지만...  넥카라 풀고 뛰어놀다 자는 벤츠 오늘 아침이 딱 일주일 채우는 날이어서 벤츠도 넥카라 풀어줬다. 여섯시에 아침밥 먹고 미친듯이 뛰어놀다가 뻗은 것 같다.  다시 해피 고양이가 되자 벤츠야  넥카라도 이제 영영 안녕 끝']
2020-12-01,[후기]아이폰 IOS14.2 소프트웨어 업데이트 후기,https://blog.naver.com/dltjs1120/222161957452,"["" 안녕하세용 오늘은 아이폰 IOS 14.2 업데이트 후기에 대해 포스팅 해보려고 합니당 사실 미루고 미루다가 오늘 업데이트를 해봤습니당  생각보다 바뀐게 많더라고요 오늘 업데이트 해보고 제가 느끼기에 크게 바뀐점을 써보겠습니당   A. 카메라 B. 아이콘 C. 어플(ex.위젯, 라디오 어플, 벅스, 트위치)       A. 카메라 1. 카메라에서 정방향이 사라졌다. '사진'을 눌러 위 화살표를 눌러야 카메라 화면 비율이 나온다 4:3, 16:9, 정방향이 나온다  음 뭔가 불편하다   2. 전면 카메라 좌우방향 유지가 생김 원래 카메라 설정에 없었고 좌우반전 안됐는데 드디어 생김   이건 좋다         B. 아이콘 1. 통화할 때 통신바()에 빨간 점이 생김 통화할 때 저렇게 빨간 점이 생기는데 왜 생기는지 모르겠다  어쩔 땐 또 파란점이 생기던데 왜인지 알려줄 사람     2. 폰 사용시 동시에 전화가 올 때 전화 상단바()가 생김 아이폰 사용 전, 안드로이드 썼을 때는 전화 상단 바가 있었다 하지만 아이폰을 약 2년간 사용 중인데 이제서야 전화 상단바가 생겼다..  폰 사용 중에 전화 오면 전체화면이 통화화면으로 바뀌는 거 너무 불편하고 매번 깜짝 놀랐었는데 이젠 너무 편하다  그리고 다이얼 숫자들도 더 작고 옹졸해진듯..       C. 어플(ex.위젯, 라디오 어플, 벅스, 트위치) 1. 위젯 추가 위젯이 너무 이뻐졌다.. 지금 네이버, 메모, 날씨, 카카오페이 등은 최신 업데이트 버전에 맞게 패치가 됐는데 미세미세, 페이코와 같은 어플은 아직 패치가 되지 않아서 사용자 추가를 해야했다.  이렇게 패치되니까 너무 편하고 유용... 애플페이 없으면 어떠냐 페이코로 결제하면 되징       2. 음악 어플 업데이트 음악 어플로 MBC라디오 미니, 벅스를 사용하는데 저렇게 밑에 어플이 생겼다 근데 뭔가 거슬린다 더 커진거 같기도...     3. 트위치 요즘 트위치를 많이 보는데 업데이트 하기 전엔 라디오 기능이 가능했다. 그러니까 화면이 보이지 않고, 소리만 나오는 라디오 기능이 가능했다.  그런데 업데이트하고 난 뒤, 트위치를 잠깐 가리면 저렇게 화면이 남는다 뭔가 불편  근데 또 소리만 나오는 라디오 기능이 가능하다  소리만 나오게 하려면 따로 라디오 설정을 한 번 더 해야하는게 좀 번거롭지만  그래도 뭐... 다행...  뭔가 멀티 뷰()기능이 가능하니까 안드 폰을 쓰는 기분이랄까..  왜 이제야 됐니.. 아이폰 업데이트....      + 충전할 때 보이는 번개모양도 커짐  + 알람도 달라짐..      총평 편리해지고 숫자도 옹졸해지고 두꺼워짐 업데이트 마음에 든다**   ""]"
2020-12-01,[후기] 아이패드 에어4+애플펜슬 2세대 언박싱 / 아이패드... ,https://blog.naver.com/yeonjaeheo/222178912417,"[' 우선 아이패드를 구매하기로 결심한 이유부터 설명을 해보자면,,, 고1때부터 5년째 LG그램을 사용중인데 과제나 공부를 하러 카페를 갈 때마다 충전기부터 마우스, 어쩔 땐 전공도서까지 챙겨야하는 이 노트북의 수고로움을 좀 덜고 싶다는 생각이 들었다. (+오래된만큼 방전이 빨라진 노트북 성능도 한 몫,,)  그래서 악세사리 또한 아이패드 크기만큼의 파우치 안에 패드와 애플펜슬, 키보드가 깔끔하게 다 들어갈 수 있는 걸로 열심히 찾아보고 있는 중   아이패드는 그저 이 노트북의 부담을 좀 덜어주기만 하면 되기 때문에 필기와 영상시청 용으로 그램처럼 가볍고 부담이 적은 모델이 나오길 기다리고 있었고, 이번 에어4 색상이 너무 마음에 들어서 초기 사용반응 좀 보다가 그냥 바로 질러버렸다..는 길쭉한 이유 늘어놓기   아이패드와 애플펜슬은 둘 다 애플교육할인스토어 에서 구매  (대학 재학생과 신입생, 교직원 등이 혜택을 이용할 수 있다고 합니다) 교육 특가 및 학생 할인 공부에 사용할 새로운 Mac 또는 iPad를 Apple 교육 할인 특가로 구입하세요. 학생, 교사, 교직원에게 혜택을 드립니다. www.apple.com  내가 산 아이패드 에어4, 256GB wifi 모델은 915,000원에(정가 979,000원),  애플펜슬 2세대는 152,000원에(정가 165,000원) 구매했다. 에어4 64GB 모델은 약 20만원이나 더 싸기 때문에 이걸로 사도 좋을 뻔 했지만, 주변에서 하도 용량이 큰걸로 사라 하길래 진짜 별 생각없이 오래 쓸 생각으로 산 것 같다    삼일만에 온 애플펜슬 아이패드 메세지엔 Merry Christmas라 적은..  온라인으로 구매할 때 포장메세지 적는 칸이 있길래 나는 또 상자에 이렇게 적어서 기분좋게 주려나보다 해서 잔뜩 기대했는데 진짜 헛걸 기대했다. ( 연말 택배기사님 산타 만들어버리기)   1세대를 안 써봐서 잘 모르겠지만 2세대부터는 저렇게 패드에 자석처럼 달라붙으며 충전이 되는 식으로 바뀌었다고 들었다.  필기하고 내려놓았을 때 굴러가지 않도록 한 면을 각지게 만든 것도 아주 마음에 든다.   언박싱 했지만 패드가 오지않아 2주동안 상자행이었던 내 첫 애플펜슬    대망의 쌈무그린 두둥-  아침에 일어났는데 등기가 왔다고 문자가 와있었다. 왜 등기를 우편으로 생각했는지 모르겠는데 난 당연히 우편일 줄 알고 나중에 우편함에서 찾으려다가 혹시나 하고 소화전을 열었다. 그런데 애플펜슬이 왔을 때랑 비슷한 상자가 있는 걸 보고 진짜 놀랐따. 왜냐하면 아이패드는 수령일 기준보다 3일 뒤에 오기로 되어있었기 때문...  받자마자 기쁜 동시에 든 생각 1. 필름이랑 케이스 안사둬서 들고 나가지 못함 2. 있어도 가지고 갈 카페 없음 하.. 진짜 슬프다   구성품은 ▶ 충전기 헤드, c타입 충전기, 설명서   끝  환경을 참 사랑하는 애플 바람직하다고 해줄 테니까 그 남는 돈으로 제발 제발 제발 애플페이 만들어줘,,,  Live the life you love. Love the life you live  색이 조명에 따라 어쩌면 실버가 되기도 하는 영롱한 실물갑 쌈무그린이다..  아이패드는 주로 공부 혹은 해야될 일을 할 때 사용할 것 같아서 각인도 내가 전부터 좋아하던 문구로, 색상도 볼 때마다 기분 좋을 것만 같은 그린으로 선택한게 가장 큰 이유다  패드 뒤에 자국은 지문입니다 :)   이제 악세사리들을 하나씩 사가야 하는데 정말 고민이 많다. 뭔가 영상을 더 잘 보기 위해선 필기감을 포기해야할 것만 같고 필기감을 위해선 화질을 포기해야할 것만 같은,, 뭐 미세한 차이겠지만 어떤 능률을 더 높일지, 둘 다 어느정도 챙길 수 있는 부분은 없는지 열심히 합리화 굴려보는 중이다..    노트북만 주구장창 쓰다보니 패드는 처음이어서 알아볼 게 너무너무 많았다. 악세사리 포스팅도 부른게 다 도착하면 한번 써봐야지  *부른거 - 거치대, 애플펜슬케이스 *남은거 - 키보드, 패드 필름, 패드케이스, 펜촉팁, 파우치 r 배보다 배꼽이 더 큰 애쁠 이런   아이패드 악세사리 포스팅은 아래  [사용기] 아이패드 에어4 악세사리 추천 / 애플펜슬 케이스 추천 아이패드 악세사리는 선택지가 너무 많아서 정하는게 무지 힘들었다 ,,, 비교할 것도 많았고 내가 고른... m.blog.naver.com    아이패드 불량확인법 아이패드 에어4  유튜브에 아이패드 에어4 불량테스트라고 검색하면 정말 다양한 영상들이 뜨는데, 그 중에서 자신이 원하는거 아무거나 들어가서 하나하나 체크해보면 된다 간혹가다 화면상에 작동이 안되는 작은 점처럼 보이는 게 있다면 불량제품일 가능성이 크기 때문에 더 늦기 전에 교환을 받아낼 수 있길..   사운드(스피커) / 화면(터치감과 빛번짐) / 외관(스크래치) 이렇게 크게 세 분류로 간단히 체크만 해봐도 충분할 것 같다.   에이포 위에 올려둔 거 아니구요,, 한장한장 끼우다보니 저 한쪽 모서리에만 에이포 10장이 들어가버리기    큰 불만사항이 아니면 교환할 생각이 없었기 때문에 각인넣은 걸 감안하고 넘어가긴 하는데 찝찝한건 어쩔 수 없다.  그치만 예쁘게 잘 사용해보도록 하겠습니다  쌈무그린 만세    덕분에 종강했는데 공부의지 독서의지 불타올라서 요즘 맨날 새벽 늦게 자고있다.() 돈아깝지 않게 매일매일 사용하도록 해야지. 이로써 아이패드와 애플펜슬 언박싱 완료   ']"
2020-12-01,"[호주렌트카]호주 브리즈번 렌트카 비교(Europcar, Car... ",https://blog.naver.com/0704lym/222185155288,"['   호주에서 살면서 차가 없는 나는 어딘가 놀러갈 때 운전할 수 있는 친구하고 같이 렌트카를 빌려서 갔던 적이 있다. 두 서비스 모두 선샤인코스트  로 놀러갈 때 사용한 것으로 주행거리는 나름 비슷할 것이다. 총 두 가지 방법으로 진행했는데, 각각 장단점이 있어서 한번 비교해 보려고 한다.  1. 렌트카 업체 이용하기  호주에는 Eurocar, Thrifty 등등 다양한 렌트카 업체가 있다. 이번 렌트카 업체를 이용할 때는 스카이스캐너로 최저가 렌트카를 찾아서 렌트를 했었는데 그때 연결된 렌트카 업체는 Eurocar 였다.  렌트비용은 총 113AUD. 10시간을 하든 24시간을 하든 가격은 같았다. 일수로 계산되는듯 . 그래서 혹시 몰라 하루치를 빌렸다. 그리고 렌트에 대해서 포함되는 내용들도 같이 적혀있다. 차의 파손이나 여러가지 사고에 방지할 수 있는 내용들 인듯 내가 렌트한 자동차의 스펙 등과 비용은 주행거리는 상관이 없다는 내용이 적혀있다. 기름은 꽉 채워서 반납해야한다.  그리고 보증금 400달러, 보험비용이 추가로 드는데 나이에 따라 달랐다. 만으로 20대는 22불정도 였던 듯... 또 기름을 다 채워서 반납해야 하기 때문에 36불정도가 더 들었다.  그래서 보증금 포함해서 총 지불한 비용은 571불. 보증금은 나중에 차 확인 후 아무 문제 없다고 판단되면 45일 이내에 내 계좌로 돌려준다.  렌트카 업체는 브리즈번 공항 국내선 터미널 쪽에 있었다. Europcar Brisbane Airport  · 렌터카 업체 · Terminal Building www.google.co.kr 위의 지도 참고 해당 렌터카 업체 이외에도 다양한 렌터카 업체가 모여있으니 다른 업체를 사용하더라도 이 곳으로 가면 왠만하면 다 렌트 절차 진행할 수 있다. 렌트할 때 필요한 것은, 여권, 국제운전면허증과 한국 운전면허증, 그리고 결제할 카드(애플페이 이런거 말고 실제 카드)가 필요하다.  내가 빌린 차 그리고 렌트를 받고 나면 차에 있던 데미지들이나 차에 대한 기본정보 등이 적혀있는 계약서를 주는데, 데미지들 때문에 덤탱이 씌워질 일이 없다는 것이 장점. 이것을 기준으로 차를 아무문제 없이 사용했는지 나중에 체크한다. 그래도 혹시 모르니 차 상태를 미리 이용 전에 사진 찍어뒀다. 차 안과 외관은 굉장히 청결했다.  위의 계약서 부분내용을 보면 어떤 기름을 쓰는지 등등 (이건 내가 기름을 채울때 유용) 차에 대한 정보가 나오고 데미지 내용이 잘 적혀있다. 우리가 확인한 내용과 일치했다. 아무래도 렌트카를 빌리는 입장에서는 정확하고 믿을 만한 시스템인 것 같긴하지만 보증금이 쎄고, 바로 공항에서 차를 픽업하고 반납하는게 가능하기 때문에 이동하는 데 사용되는 교통비가 들수 있다는 단점이 있다   2.카 쉐어링 서비스 이용하기 (Car next door) 호주에서 주로 사용하는 카쉐어링 서비스 중에 하나가 Car next door 라는 어플서비스이다. 이건 업체와 고객을 연결해 주는 것은 아니고 내 거주지 주변에 있는 카쉐어링을 제공하는 사람과 연결 해주는 어플이다.  Car next door어플을 다운 받은 후 픽업,반납이 편한 장소로 검색을 시작하면 여러 차들이 뜨는 데 가격과 차 정보드를 잘 확인하고 골라서 신청하면 된다. 이 때 면허증 정보나 나의 신상정보 등을 입력하고 제공자의 승인이 이루어지면 렌트 절차가 끝난다.  총 지불한 가격은 101.36불. 여기에 보증금 100불도 따로 지불한 걸로 기억한다. 그리고 픽업받았을 때 기름은 꽉 채워져 있지 않아 우리가 직접 결제 하여 채워줬다. 그게 약 30불 정도 였던 것 같다. 이 서비스의 경우 주행거리를 기준으로 비용을 계산한다. 그리고 픽업하는 장소로 가는데 너무 아침 일찍 (아침 7시 쯤)빌리러 간 탓일까 주인이 직접 나타나지 않고, 차 키를 넣어둔 작은 금고위치와 비밀번호만 받은 채로 우리가 직접 키를 찾아서 이용해야 했다. 복불복 이겠지만 차 내부는 그리 깨끗하지 않았다.  Noosa head beach  두 서비스를 통해서 무사히 선샤인 코스트에서 재밌게 놀다왔고 차 없는 뚜벅이에게 좋은 서비스들이었다. 3. 요약 정리 렌터카 업체 카쉐어링 업체 총 비용(보험비용 포함) 보증금:400달러 571불 -일수로 책정된다. 보증금:100불 101.36불 -실제 주행거리로 책정된다. 장점 -내가 정말 내지 않은 사고나 데미지에 대한 판단이 분명하다. -차가 외관과 내부 모두 청결하다. -집이나 숙소 근처에서도 렌트가 가능하며, 반납 또한 간단하다. -픽업,반납 시간대도 원하는 시간대에 주인과 협의하여 정할 수 있다. -비교적 저렴하며 더 넓은 선택지가 있다. 단점 -공항에서 픽업,반납을 해야한다. -보증금이 너무 쎄다. -업체가 영업하는 시간 이내에서만 픽업과 반납이 가능하다. -혹시 공항으로 픽업을 따로 가야한다면 추가 교통비가 든다. (나같은 경우에는 디디 총 100불..) -운이 나쁘면 주인과의 분쟁이 있을 소지가 있다.(차 사고나 데미지) -청결도와 차의 성능은 복불복  어디를 가는지 등등 상황에 따라 다르겠지만, 멀리 이동을 해야하고 공항에서 도착하여 이동한다면 확실하게 렌트카 업체를 사용하고, 가까운 지역에 놀러가는 경우에는 카쉐어링으로 간단하게 사용하는 것이 좋을 것 같다. ']"
