post_dates,title,url,full_text
2020-06-01,Apple 애플 WWDC 2020 일정 공개 차기 아이폰12 및 iOS... ,https://blog.naver.com/eseok_/222009448832,"[' Apple 사의 WWDC 2020 바로 애플 세계 개발자 컨퍼런스 인데요. 이 행사는 어제였죠. 6월 22일 부터 26일 까지 총 5일간 진행되는데, 2020년 올해는 코로나19로 인해 온라인 형태로 최초 진행한다고 밝혔습니다. 따라서 여러 사람들은 온라인 진행에 대한 걱정과 우려가 있다고 하네요. 원활한 피드백이 되는지 부터 주요 인사들의 경우 온라인이 아닌 오프라인 모임식으로 만나 개최를 하다보니, 미비된 부분에 대한 걱정이 있는거겠죠.  WWDC 2020 키노트 현지시간으로 23일 새벽2시경이 되었겠군요. WWDC 2020 키노트. 바로 새로운 iOS인데요. 이 외에도 iPadOS, macOS, tvOS, watchOS 가 발표되었다고 하니 기대를 가져볼만 합니다. 주로 국내 사용자들은 iOS 즉, 아이폰에 대한 소프트웨어의 개선성을 많이 보시고 계십니다. 과연 국내엔 애플페이가 언제 도입될까 부터 시작해서... 많은 범용성을 지닌 소프트웨어가 나오길 바라는 마음인데요. 이번 행사는 온라인으로 진행되기 때문에 어제 보신분들도 계실꺼라 생각합니다. 애플 홈페이지나 개발자 앱, 개발자 웹사이트, 애플TV앱, 유튜브 등 스트리밍 서비스를 진행한다고 하니, 놓치신 분들은 검색하셔서 다시보기 가능하실거에요.  개발자 포럼(iOS 14 및 기타)  이번 차기작인 아이폰12에 탑재될 새로운 운영체계는 iOS14 입니다. 보통 공개 전 보안에 굉장한 공을 들이지만 올해는 중국의아이폰 개발 버전으로부터 일부 내용이 유출되었는데요. 그중 하나라고 보시면 될듯 합니다.  새운영체계에서 눈에 띄는 변화는 홈 위젯입니다. 기존과는 다른 배열, 시스템으로 가장 이목이 집중되는 파트라고 보시면 됩니다. 사용자가 원하는데로 커스텀 배열이 가능한 위젯 배열로 변경되어 출시된다고 합니다.  홈 위젯은 안드로이드 폰에서는 오래전부터 있어 왔던 기능이라, 기존 삼성사용자는 별다른 특이점을 발견하지 못하지만 애플만 사용하셨던 분이라면 기대를 가져볼 만합니다.  그리고 가장 중요한 부분이죠. 통화 중 녹음 기능. 여러 IT 분석가들이 미리 본 iOS14 초기 내부 빌드에는 통화 녹음 기능이 존재했습니다. 이 때문에 각 국가의 통화 녹음 관련 법적 허용 수준에 따라 애플워치의 심전도 측정기능(ECG)와 같이 지역에 따라 사용할 수 있을지 여부는 협의 진행중에 있는 것으로 파악됐습니다.  그다음으로는 애플페이 최근 많은 사용자들의 기대감에 휩쓸게 했던 기능이죠. 최근 현대카드가 애플 페이 전용 카드를 낼 수 있다는 소식을 발표한 뒤로 아이폰 사용자들의 애플페이에 대한 기대감이 치솟았습니다. 미국의 애플 카드와 비슷한 캐시백 혜택을 주는 제로카드가 중단/단종되고 새로운 카드가 애플페이를 쓸 수 있게 된다는 추측이 있었지만 아니라고 판정났었죠... 하.지.만 현대카드는 새로운 형태로 리뉴얼된 제로카드 상품을 출시 했습니다. 애플페이가 국내에 상용화되기에 가장 문제되는 것은 수수료율인데요. 이 부분만 해결되면 아이폰도 삼성페이와 같은 활용도를 지닌, 혁신에 가까운 변화가 있지 않을까 합니다.  팀 쿡(애플CEO)의 기조 연설을 시작으로 개최된 2020 WWDC. 100여 개의 세션과 1:1 개발자 랩 등이 회상회의와 동영상으로 진행되는 점 참고 바라며, 새로운 소식이 전해지면 포스팅하도록 하겠습니다.  애플 apple wwdc 2020wwdc wwdc2020 애플컨퍼런스 애플세계개발자컨퍼런스']"
2020-06-01,"호주 멜버른 워홀 D+331 : 마지막 출근, 세인트 알리, 시티... ",https://blog.naver.com/jdaeun96/222001457020,"[' 호주 멜버른 워홀 D+331 : 진짜 마지막 출근, 세인트 알리, 시티 환전하는 곳, 셜록홈즈 펍, 하정우 영화촬영 구경, 마지막 밤 마지막 출근 여기는 호손에 있는 제임스 공원       예쁘지 않아서 흥이다         헝... 모든 게 마지막 ... 손님들에게도 마지막 인사를 했다        낸시가 나에게 준 랩  나 요리 안하니까 내일 먹으라며          갑자기 매우 그립넹,,,,        그리고 토니가 나 카페 음식 안먹어봤으니까 마지막으로 먹구 가라며         그리고 이 때 아직 홀리데이가 끝나지 않은 회사원들도 많아서 못 본 손님들이 많다 그래서 남긴 쪽지         다들 잘 지내니..(아련         낸시가 내가 저거 손님들에게 쓰니까 나에게 써야지  이랬는데 낸시껀 이미 다 준비했었다고요  마스크팩과 전통 굿즈와 편지와 같이 주니까 감동받았다  마지막 포옹도 하구        그렇게 마지막 인사를 마친 뒤, 시티로 간다         그동안 수고했던 나의 손... 왜 나 스스로에게 울컥하냐 이제와서         하 정말 멜번에서 못 가본 카페가 수두룩한데.. 세인트알리를 이제야 가본다        역시나 많았던 사람 그리고 카페가 되게 덩그러니 있음           메뉴판 참고하세용        내가 호주에 가져왔던 편지지들 그래도 마지막에 많이 사용했다 귀여운 비숑도 다 썼다         그립다 호주 플랫화이트          세인트알리 원두는 한국에서도 이제는 마실 수 있지만 그래도 본점을 가본 것이 뿌듯         길게 정성스럽게 썼다.       마스터 언니 삼촌에게도 썼다        루씨, 제이크삼촌, 진언니         그리고 환전하러 왔다 한국에서 환전할 시간이 없어서 여기서 해야함 그리고 어짜피 호주-한국-유럽으로 두번하면 더 손해니까 호주에서 유럽돈으로 바로 다이렉트로  환전은 여기가 수수료 없기로 유명하다 시티 내 큐브이 쪽에서 그 대각선으로 들어가는 곳에 저 익스체인지 표시 있는 곳 아마 가면 사람들이 항상 줄 서있어서 어딘지 알 거다          1시간 정도 기다렸나.. 1215불을 현금으로 뽝         유로랑 파운드로 교환 완료  너무 많이 하지는 않았다 소매치기 우려로 인해서 카드를 많이 사용함. 호주랑 유럽은 애플페이 모두 되니까        호주 하늘도 너무 그립넹,,          괜히 오빠식당가서 오랜만에 매운삼겹살버킷 먹었다 와 이거 진짜 많이 먹었는데 특히 호주 첫달에 진짜 많이 먹었는데... 추억이다 추억이야         그리고 내 마지막 주급도 챙기러 주말 카페에 왔다        루이가 커피 만들어줌 날 위해  다들 잘 사냐고         땡큐          그리고 저녁에는 안나언니와 약속이 있었다 이것저것 하다보니까 시간이 금방 갔다        가보고 싶었던 셜록홈즈 펍        분위기 짱 좋았다       언니가 지나가다 보여서 샀다고 나 노란색 좋아하니까 노란색 주고 언니 핑크 좋아하니까 핑크 하고 사진 찍음         이 사진 매우 마음에 든다... 그래서 엽서로도 만들었던         언니가 이 가방 예쁘다고 볼 때마다 이야기 했었는데 언니가 자기 주라고 그래서 음 그럴까 해서 갑자기 무료 나눔  근데 나중에 짐싸니까 주길 잘했다 큰 가방은 아니지만 넣기엔 애매했던 아무튼 언니가 잘 사용하고 인증샷도 보내줬다           그렇게 언니와 멜번에서 마지막 맥주... 지내는 동안 고마웠어           그렇게 트램타러 가는데 뭐가 촬영하고 있어서 호기심에 뭐지 뭐지 하다가        어떤 사람에게 뭐 촬영하는거야 언니가 물어보니까 모르겠는데 한국 영화래 이래서 우리가 어 우리가 코리안인데 이래서 개웃겼음         뭔가 느낌에 하정우같았는데 왜냐하면 며칠전에 하정우 고깃집에서 봤다는 목격담이 있었음  암튼 계속 대기 상태인데 누군지 너무 궁금해서 근데 하정우가 맞는 거 같은데 묻지도 못하고 용기내서 저 사이로 지나가다 보니까 하정우 진짜 맞았음  저 멀리 있는데 딱 보였음 근데 하정우 안 좋아함 그냥 신기해서          그렇게 집으로.....         멜번에서의 밤은 마지막이다. 다음 날 떠나니까  그래서 괜히 아쉬워서 집으로 가는 길을 야간모드로 열심히 찍어봤다         내가 항상 볼 때마다 예쁘다고 생각했던 집         그리고 우리집... 이떄도 실감은 안났는데..        그리고 집에와서 짐 정리 이거 선물용으로 산 것들 영양제와 꿀과 저 블랙모어스 비타민크림 그리고 판도라          이건 날 위한 향수 아직 사용안해봐서 향을 모르겠닼 조만간 오픈해야지  마이 션,,         열심히 짐 싸는 중....         이젠 정말 필요없구나 레쥬메들, 안녕이다   시원섭섭하더라        이제 다음 포스팅이 정말 마지막 출국 날이다.']"
2020-06-01,[홍콩 회사] 홍콩 환전 업체 안내,https://blog.naver.com/atozhongkong/221997284194,"[' 환전 업체 안내  여러 시중은행을 방문하여 직접 환전 신청을 하고 환전을 하던 전의 모습과는 달리 핀테크가 금융시장의 화두로 떠올라 전자기기를 이용하여 쉽고 빠르게 환율을 비교하고, 환전을 하는 현재의 모습입니다.  따라서, 모바일 어플리케이션, 웹사이트로 사용되는 세계적인 환전 업체와 그들의 장단점에 대해 포스팅하려 합니다.  1. TransferWise  HKD 5,000 -> USD 636 이 름 최소 이체 금액 이체 속도 제공 서비스 수수료 비율 수령 금액 (수수료 포함) TransferWise USD 1 최소 1-2일 온라인 은행 계좌 --> 은행 계좌 HKD 70 0.129 USD 636  2. TorFX  HKD 5,000 -> USD 635 이 름 최소 이체 금액 이체 속도 제공 서비스 수수료 비율 수령 금액 (수수료 포함) TorFx USD 2,000 최소 1일 온라인, 모바일, 에이전트 HKD 0 0.127 USD 635    3. WorldFirst   HKD 5,000 -> USD 635 이 름 최소 이체 금액 이체 속도 제공 서비스 수수료 비율 수령 금액 (수수료 포함) WorldFirst USD 1 최소 1일 온라인, 모바일 HKD 0 0.127 USD 635   4. OFX   HKD 5,000 -> USD 634 이 름 최소 이체 금액 이체 속도 제공 서비스 수수료 비율 수령 금액 (수수료 포함) OFX USD 100 최소 1일 온라인, 모바일, 에이전트 HKD 15 0.127 USD 634    5. WorldRemit   HKD 5,000 -> USD 641 이 름 최소 이체 금액 이체 속도 제공 서비스 수수료 비율 수령 금액 (수수료 포함) WorldRemit USD 1 최소 1시간 온라인 은행 계좌 --> 은행 계좌, 현금 이체, HKD 10 0.129 USD 641   6. Western Union   HKD 5,000 -> USD 643 이 름 최소 이체 금액 이체 속도 제공 서비스 수수료 비율 수령 금액 (수수료 포함) Western Union USD 1 최소 당일 온라인, 모바일, 에이전트, 계좌 간 이체, 현금 이체 HKD 15 0.129 USD 643     [장단점 및 기타 참고사항] 장점 단점 기타 참고사항 TransferWise ·         최소 이체 금액 존재 X ·         중간 시장 금리 사용 ·         금액 투명 ·         애플 페이로 결제 가능 ·         현금 수거 불가능 ·         다른 업체보다 제공하는 통화의 수가 적음 ·         이체 내역 추적 / 확인 가능 ·         다른 언어 제공 ·         Live exchange rates X ·         Set rate alerts X TorFX ·         경쟁력 있는 환율 ·         추가 비용 X ·         현금 수거 불가능 ·         현금, 수표 지불 X ·         영어만 지원 ·         이체 내역 추적 / 확인 가능 ·         다른 언어 제공 X ·         Live exchange rates O ·         Set rate alerts O WorldFirst ·         거래 수수료 X ·         경쟁력 있는 환율 ·         대표 통화 사용 시 당일 이체 가능 ·         최대 이체 금액 제한 X ·         소액 이체 불가능 ·         계좌이체만 가능 ·         현금 수거 불가능 ·         이체 내역 추적 / 확인 가능 ·         다른 언어 제공 X ·         Live exchange rates O ·         Set rate alerts X OFX ·         전후 환율 모니터 가능 ·         거래 수수료 X ·         은행보다 좋은 환율액 ·         최소 이체 금액 $250 (이하로는 불가능) ·         신용카드, 현금 지불 X ·         영어만 지원 ·         이체 내역 추적 / 확인 가능 ·         다른 언어 제공 X ·         Live exchange rates O ·         Set rate alerts O WorldRemit ·         현금 수거 가능 ·         최소 이체 금액 X ·         경쟁력 있는 환율 ·         모바일 머니로 펀드 수령 가능 ·         송금 금액 제한 O ·         이체 금액에 따른 추가 수수료 발생 ·         이체 내역 추적 / 확인 불가능 ·         다른 언어 제공 O ·         Live exchange rates O ·         Set rate alerts O Western Union ·         계좌 이체, 현금, 카드, 애플 페이 지불 가능 ·         다양한 통화 지원 ·         현금 수령을 위한 이체 속도 빠름 ·         환율 비쌈 ·         지정된 몇 개국에 대한 송금은 중요시함 ·         이체 내역 추적 / 확인 가능 ·         다른 언어 제공 X ·         Live exchange rates O ·         Set rate alerts X *회사명을 클릭하시면 해당 웹사이트로 이동하실 수 있습니다.   이 중 환전 수수료의 비용이 다른 업체보다 가격이 나갈 경우, 환전 / 이체 금액에 따라 수수료가 변동되는 곳도 존재합니다. (환전 / 이체 금액이 적을수록 높은 수수료, 많을수록 낮은 수수료)   장단점, 기타 참고사항과 비율을 고려하여 본인에게 가장 적합한 서비스를 찾아보실 수 있습니다.    아토즈홍콩컨설팅 홍콩법인설립과 세무보고를 도와드립니다. pf.kakao.com ']"
2020-06-01,스마트폰 속의 NFC란 무엇인가요?,https://blog.naver.com/nord-vpn/221989872383,"[' 신용카드 또는 다른 방법으로 VPN을 구입하세요 | NordVPN 내게 맞는 플랜을 선택하세요 nordvpn.com  커피 값이나 기차 삯을 핸드폰으로 지불하는 것은 신기한 마법이 아닙니다. 이는 NFC 테크놀로지 덕분에 가능합니다. NFC는 데이터를 가까운 다른 기기로 전송하도록 돕죠. 하지만 이는 과연 안전할까요 NFC 와 NFC의 보안성에 대해 더 알아 보도록 하세요.  NFC란 NFC 는 near-field communication즉 근접 무선 통신의 약자입니다. NFC가 탑재된 스마트폰으로 사진, 연락처, 파일 그리고 결제금액 같은 데이터까지 쉽게 주고 받을 수 있습니다. NFC는 두 대의 각 기기가 서로 약 10cm 이상 떨어지는 즉시 연결 되기 시작합니다.  NFC는 와이파이, 3G, LTE 또는 전력,수동 페어링을 필요로 하지 않는 이 알에프아이디 즉, 전파 식별에서부터 발전했습니다. NFC 칩은 보안 카드 혹은 다양한 결제 카드나 여행 카드에 사용 됩니다. 또한 대부분의 최신 스마트폰은NFC 칩을 사용하는데 주로 비 접촉식 모바일 결제(contactless mobile payment) 에 사용됩니다.  안드로이드와 NFC 안드로이드 4.4 또는 후속 버전의 운영체계는 NFC를 지원합니다 (독자들이 보유한 거의 대부분 스마트폰은 아마도 분명 그럴 것입니다). (폰 제조사에 따라) 우리가 안드로이드 페이나 삼성 페이를 사용 할 수 있는 이유도 NFC덕분입니다. 안드로이드 폰에는 안드로이드 빔이라는 기능이 있는데 이는 전화 번호, 파일, 앱, 사진 그리고 지도까지 교환할 수 있도록 해줍니다. 다른 기기와 가까워지면 “자동으로 빔을 실행할까요” 라는 메시지가 뜹니다.  하지만 예상보다 저조한 반응에 이 기능은 안드로이드 9.0 운영체계가 소개되면서 사라졌습니다.  NFC와 아이폰 아이폰 6 혹은 후속 모델에는NFC가 탑재되어 있습니다. 아이폰 사용자에게 안드로이드 빔같은 기능은 없지만 모바일 결제는 여전히 사용 가능합니다. NFC가 없이 애플 페이는 작동하지 않죠.  NFC 보안성은 어떤 식으로 작동할까 깜박하고 집에 지갑을 놓고 왔을 때도 NFC는 훌륭한 역할을 합니다. 하지만 NFC 사용이 과연 안전할까요 자, ‘인접성’라는 요소 때문에 이중으로 인증을 거쳐야 되고 어떤 이들은 신용 카드보다 더 안전하다고 하기도 하죠. 이 세상 모든 것은 해킹 가능하지만 그럼에도NFC 모바일 결제는 상당히 안전합니다. 실제로 이를 해킹하기란 매우 어려운 일이고 들인 노고 스러움에 비해 별 소득이 없죠.  애플 페이, 안드로이드 페이, 그리고 삼성 페이 모두 안정성을 위해NFC결제를 토큰화 합니다. 토큰 화는 민감한 데이터를 대리 데이터로 치환하는 과정입니다. 신용 카드 결제는 계좌 번호, 이름, 주소, 그리고 카드 유효 기간과 같이 여러 가지 민감한 정보를 요구합니다. NFC와 토큰 화 과정을 통해 지불을 한다면, 상점은 당신의 실제 데이터를 볼 수 없게 됩니다. 아래와 같은 일들이 일어나게 되죠.  1. 애플 페이 혹은 안드로이드 페이 지갑을 엽니다. 지문 혹은 안면 인식으로 본인임을 인증합니다. 상점의 무선 카드 리더기에 당신 핸드폰을 터치합니다.  2. 당신 핸드폰은 구글 또는 애플에게 당신의 주요 계좌 번호를 전송합니다.  3. 구글/애플은 은행에게 당신 은행 계좌와 관련된 무작위 일련 번호로 이뤄진 토큰을 발행할 것을 요청합니다.  4. 은행은 해당 데이터를 구글/애플에게 전송하고 구글/애플은 그 정보를 다시 핸드폰으로 넘깁니다.  5. 당신의 핸드폰은 NFC를 통해 토큰을 상점으로 보냅니다.  6. 이제 상점의 결제 단말기가 당신의 토큰이 진짜인지 아닌지 판단하면 이 거래에 대해 지불할 수 있게 됩니다. 토큰은 카드사에 보내집니다.  7. 토큰과 당신 은행의 연관성이 입증되면, 이 거래는 승인되고 돈은 당신의 계좌에서 인출이 됩니다. 상점은 토큰을 제외한 당신 신상에 대한 어떠한 정보도 보지 않았죠   플랫폼들 마다 조금씩 다른 차이가 있습니다. 신용 카드사는 지불을 승인하고 당신 핸드폰에서만 사용할 수 있게 해주는 DAN(device account number)에 서명합니다. 차이점은 애플이 당신 스마트폰에DAN을 저장하는 반면에 안드로이드는 클라우드에 저장한다는 점입니다. 애플처럼 삼성 페이는 당신 스마트폰에 저장을 하고 귀하의 DAN을 한층 더 강화하기 위해 추가 보안 프로토콜을 사용합니다. 결론 지으면, NFC 상당히 안전한 기술력입니다.  만약 핸드폰을 분실할 경우 누군가 NFC 가 탑재된 당신의 핸드폰을 이용해 당신 은행 잔고를 털어버릴 수 있을까요 모바일을 이용한 결제가 이뤄지려면 비밀번호, 지문, 얼굴같은 생체 데이터로 추가 승인을 제공하여야 합니다. 만약 이와 같은 2단계 인증이 설정 되어 있지 않다면 누구도 모바일 결제를 사용할 수 없습니다. 한편, 만약 핸드폰이 잠금 해제 상태이거나 2단계 인증이 없다면 NFC 결제보다 더 심각한 문제를 마주하게 될 수도 있습니다.  핸드폰을 잃어버려 누군가 당신 은행 계좌를 해킹할까 염려스럽다면 은행에 연락하고 계좌를 폐쇄해야 할 것입니다. 또한 가능하면 원격으로 공장 설정 상태로 핸드폰을 리셋 해야만 할 것입니다 (공장 설정하는 법은 여기 를 참고하세요). 신용카드 또는 다른 방법으로 VPN을 구입하세요 | NordVPN 내게 맞는 플랜을 선택하세요 nordvpn.com ']"
2020-06-01,"애플 WWDC 2020, 기조 연설을 6월 22일 오전 10시부터",https://blog.naver.com/applelhub/221998816019,"[""  오늘 애플은 WWDC 2020, 기조 연설을 6월 22일 오전 10시부터 시작한다고 발표했습니다 우리 시각으로 6월 23일 새벽 두시입니다 잠못 드는 새벽이될 수도 있겠네요.. 실시간 방송을 보며 중요한 발표는 바로 포스팅을 할 예정입니다.  기조 연설은 공식 애플 사이트 및 Apple Developer 앱 및 사이트, 애플 TV 앱, 유튜브등에서  실시간으로 시청 할 수 있습니다. 개발자 행사인만큼 iOS 14 버전과 맥OS 10.16이 발표될 것이고 새로운 제품이 발표도될 수 있습니다.  지금까지 나온 루머를 정리해보면 아래와 같습니다.  인텔을 버리고 ARM 기반 맥으로의 전환을 발표 한다  인텔맥에서 애플이 설계한 ARM칩 맥으로 전환한다는 계획을 발표할 수도 있습니다. ARM 칩을 탑재한 첫번째 맥은 2021년쯤 출시 될것으로 보여지고 있으며 이 변화는 우리에게 분명 긍정적인 혜택이 있을것으로 보입니다.  신형 아이맥 (23인치)  아이맥이 기존 21.5인치에서 23인치으로 커지고 베젤이 얇아지며, 스페이지 그레이 색상이 추가 될것이라는 루머가 있습니다. 바뀐 디자인의 아이맥이 발표될 수 있기에 지금 아이맥을 구입하는 일이 없어야 겠습니다.  에어태그 분실방지 태그 '에어 태그'를 애플이 개발중이라는 루머는 오래전부터 있었는데 역시 이번엔 발표될 수 있습니다. 도대체 어떤 서비스 어떤 제품일까요 이제 정체가 밝혀지길 바래봅니다.  에어팟 프로 스튜디오  다음은 유명한 존 프로서의 코멘트 입니다 오는 WWDC에서 오버 이어 헤드폰 - 에어팟 프로 스튜디오가 발표될것. 가격은 349달러   에어파워 야심차게 발표까지 해놓고 돌연 이건 불가능하다며 개발을 중단 했다고 애플이 솔직 인정했던 에어파워, 무슨 바람이 분건지 다시 만들기 위해 도전하고 있다는 소식이 수개월전 전해 졌었고 예측가들은 올 상반기 발표 될것이라고 분명히 했는데 WWDC에서 발표될 가능성이 높습니다. 에어파워는 소형 대형 두가지 크기가 존재한다고 알려져 있습니다. 출시된다면 에어팟의 성공처럼 뜨거운 반응이 일어날까요  한번 공개했다 철회하고 다시 등장이라 궁금증을 폭발시키고 제품을 내놓는 애플의 전략이 물거품이 되어버린 지금, 더 특별한 것이 있었으면 좋겠습니다. (잡스가 있었다면 에어파워 팀은 모두 짤렸겠죠)  늘 그랫듯 이 날은 밤을지샐것 같습니다.  그리고 우리나라 사람들이 기다리는 것들도 많이 있죠. 애플워치로 심전도 측정하는 기능이 더 많은 국가로 확대한다는 소식과 애플 TV+가 더 많은 국가에서 서비스 된다는 것, 또한 새로 오픈 예정인 스토어 중에 한국이 포함 등..  또 우리 나라 사람이 바라는게 있다면 무엇이 있을까요... 애플페이""]"
2020-06-01,<트랜스퍼와이즈> Transferwise 미국에서 한국으로 소액... ,https://blog.naver.com/ythink5/221994830396,"["" http://prf.hn/click/camref:1101l7sB5 Transfer Money Online | Send Money Abroad with TransferWise Banks charge a lot for overseas transfers. We don't. Transfer money abroad easily and quickly with our low cost money transfers. prf.hn 위는 저의 transferwise affiliate 링크이고 이를 통해 가입 후 한국으로 송금시 소정의 커미션을 받습니다. 트랜스퍼와이즈는 $1000불 이하 소액 송금하시는 분들이라면 정말 유용하게 쓰실 수 있습니다.  오늘은 2020년 6월 8일  매달 소정의 금액을 한국으로 보내야하기 때문에 트랜스퍼와이즈를 이용하고 있는데요, 오늘은 환율이 저번달 보다 많이 낮아 젔지만 그래도 송금 시간과 낮은 수수료 생각하면 괜찮은 듯 합니다.  오늘은 $85불 송금 보장 환율 1,198.18원 수수료 3.62불 총 97,508원 이 한국계좌로 입금 예정입니다.  $85불 송금 예정 - 수수료 및 환율 확인 후 보내기 개인은 송금 시 95만원까지 일 년에 $5만 불까지 송금이 가능  받는 사람의 정보 입력 - 생년월일 필요 송금 전 모든 정보 확인 송금방법 - 저는 미국계좌에서 이체를 하지만 애플페이 데빗카드 크레딧카드도 사용가능. 주의 할 점은 크레딧 카드로 보내게 되면 카드사에서 추가적으로 fee가 붙을 수 있으니 확인 후 보내야 함. 미국 계좌 정보 확인. 송금은 한국 계좌로 먼저 입금이 되고 며칠 후가 되서야 미국계좌에서 돈이 빠져 나감 송금 하기 누르면 보이는 화면 6/9일까지 들어올 거라는 문구  소액 송금하실 분들에게 추천드리고, 궁금하신 점은 쪽지나 댓글 남겨주세요  http://prf.hn/click/camref:1101l7sB5 Transfer Money Online | Send Money Abroad with TransferWise Banks charge a lot for overseas transfers. We don't. Transfer money abroad easily and quickly with our low cost money transfers. prf.hn""]"
