post_dates,title,url,full_text
2021-02-01,맥세이프 카드지갑 단점보완한 아이폰12프로 투명 프레임케이스!,https://blog.naver.com/gkduddlrjf/222229122617,"['  안녕하세요 남용순입니당 저는 약 10년 동안 변함없던 애플 유저였었다가 작년에는 잠시 z플립에 눈이 멀어 8개월간 갤럭시를 사용해 본 경험이 있는데요. 그도 그렇듯 워낙 ios 체제에 오랜 시간 동안 익숙해져서 그런지 도저히 적응이 되지 않아 아이폰12프로가 출시되자마자 바로 기변해 버렸습니다. 저도 어쩔 수 없는 앱등이인가 봐요..    하지만 그런 저를 고민하게 만들었던 편리한 부분이 한 가지 있었으니.. 바로 삼성페이 집 앞에 잠깐 나갔는데 갑자기 돈 쓸 일이 생겨도 전혀 당황하지 않고 바로바로 쉽게 결제할 수 있어서 너무나도 잘 활용해 왔거든요. 근데 아시다시피 애플은 애플페이 서비스가 있어도 한국에는 도입되지 않았기 때문에 그림의 떡이죠. 정말 다 좋은데 그 부분이 참 아쉽잖아요.   그런 아쉬움을 토로하는 한국 유저들을 알고서 따로 겨냥한 것인지.. 아이폰12 시리즈부터는 마그네틱(자석) 방식의 무선 충전 맥세이프 기능을 적용한 가죽 재질의 카드지갑 액세서리를 선보였는데요. 실제로 호적메이트도 앱등이인 터라.. 캘리포니아 포피 컬러 정품을 75,000원에 구매해서 직접 실물 본 적이 있는데 솔직히 비싸긴 하지만 예쁘건 예쁘더라고요. 퀄리티 좋고   근데 치명적인 단점이 있어요. 자력이 너무나도 약합니다. 아니 다른 것도 아니고 지갑인데 확실하게 고정되어 있지 못할망정 아랫부분(하단부)을 살짝만 손가락으로 밀어도 옆으로 밀리는 거 있죠. 게다가 자성으로 인한 카드 마그네틱 손상을 막기 위해서 전파 차단용 철판을 덧대어 놔서 그런지 교통카드 태그도 어려운 편이에요. 직접 꺼내서 태그 해야지 인식될 정도거든요.  사실 맥세이프 카드지갑이 감성적이고 예쁘긴 하지만 그 가격에 비해 단점이 좀 많이 치명적인 것 같아요. 물론 모두 감안할 수 있을 정도로 구매하고 싶다면 어쩔 도리가 없지만 실용성을 본다면 너무 돈 아깝습니다. 한마디로 보기만 좋은 예쁜 쓰레기라고나 할까요..   그래서 그냥 애플페이 나올 때까지 주렁주렁 들고 다녀야겠다 싶던 찰나 디자인 굿 호환성 굿 서드파티 제품을 발견하게 되었어요. 바로 프레임바이 투명케이스   보시는 것처럼 요 제품은 깔끔하면서 군더더기 없는 디자인이 특징인데요. 기존 맥세이프 카드지갑의 단점을 완벽하게 보완해서 나온 아이폰12프로케이스 라고 보심 될 것 같습니다. 당연히 PRO뿐만 아니라 12, 미니, 맥스 기종도 모두 호환 가능해요.   사이즈는 신용카드 보다 살짝 큰 60mm x 95mm여서 사용할 때 딱히 걸리적 거린다던지 불편한 부분은 전혀 없더라고요. 위 사진은 대략적인 크기 비교를 위해 프레임바이 투명케이스와 아이폰12프로, 일반적인 카드지갑을 함께 놓고 찍어 보았어요. 확실히 투명한 에어 컬러라 심플하고 슬림 하네요. 맘에 쏙 들어요 :-)   디자인도 디자인이지만 무엇보다 가장 중요한 부분은 자석이 얼마만큼 강력한지가 관건인데요. 프레임바이 서드파티는 맥세이프의 정식 규격에 일치하도록 자석의 위치와 세기를 정교하게 설계하였다고 해요. 그렇다 보니 후면 부분에 살짝만 가져다 대도 알아서 착 하고 가운데를 맞춰 주더라고요. 따라서 완벽한 호환성을 자랑합니다. 위 움짤처럼 사정없이 흔들고 탈탈 털어도 전혀 흔들림이 없어요. 절대 분실될 일 & 걱정 놉놉   수납 방법은 슬라이드 식이라 편리한 편이에요. 최대 2장까지 수납 가능해서 자주 사용하는 체크카드나 신용카드를 넣을 수 있고 필요에 따라 신분증이나 현관 키 등을 넣고 다니면 되니까 활용도가 아주 굿굿이쥬   특히 2장 중에 위에 거는 요렇게 밀어 올려 꺼낼 수가 있는데요. 아직까지 NFC 태그 결제가 아닌 IC 칩으로 결제해야 하는 곳이 대부분이다 보니 바로바로 꺼내서 결제할 수 있다는 장점이 좋더라고요. 참고로 정품은 핸드폰에 부착되어 있는 상태에서 카드 빼기 많이 힘듭니다.. 가죽이라 그런지 자꾸 뭉텅이로 딸려 나오는 거 있죠. 새해 첫날 호적메이트가 커피 사준대서 카페 갔다가 안 나와서 주섬주섬 거렸다는 후문이..    확실히 가죽이 아닌 플라스틱 투명케이스라 늘어날 걱정 1도 없으니 아주 만족스러워요. 또 두 장을 넣고 다니더라도 옆모습은 여전히 슬림 해서 보기에도 거슬리지 않아 심플한 감성은 그대로 유지되는 것 같고요. 차량용 거치대에 놓을 때 굳이 빼지 않아도 돼 딱이에요   사실 프레임바이 투명케이스는 쌩폰에 붙여놔야 그 영롱한 빛을 더 발하는데.. 저는 워낙 핸드폰을 잘 떨어뜨리는 터라 기존에 쓰고 있었던 실리콘케이스에다가 부착하여 사용하고 있어요. 그나저나 원 안에 애플 사과 로고가 쏙 들어가니 겁나 예쁘지 않나요 마치 원래 이렇게 나온 듯한 같은 느낌적인 느낌이랄까요.. 헿   요즘 저는 간단하게 외출할 때 차 키랑 아이폰12프로, 프레임바이 맥세이프 카드지갑만 들고 다닌답니당 일단 거추장스럽게 클러치든 가방이든 챙기지 않아도 되니까 삶의 질이 소폭 상승하였어욬        평소 가죽 재질이 올드하게 느껴졌다면, 얄쌍하고 호환성 좋은 서드파티를 찾고 계셨다면 요 제품 추천드립니다. 생각보다 가격이 비싼데.. 싶으시겠지만 자력이 워낙 굿인데다가 정품이랑 비교하면 가성비 갑이에요. 관심 있으신 분들은 아래 링크 참고해 주시고요. 그럼 저는 이것으로 후기를 끝 마치도록 할게영   FRAME CASE 2 for MagSafe FRAME CASE 2 for MagSafe 55,000원 3,850원 (7%) (최소주문수량 1개 이상 ) 색상 상품명 상품수 가격 총 상품금액 (수량) : 0 (0개) BUY NOW ADD CART ADD WISH Share : NAVER 네이버 ID로 간편구매 네이버페이 네이버페이 구매하기 찜하기 이전 멤버십 첫달 무료가입하고 추가 4% 다음 SHOPPING GUIDE 상품결제정보 고액결제의 경우 안전을 위해 카드사에서 확인전화를 드릴 수도 있습니다. 확인과정에서 도난 카드의 사용이나 타인 명의의 주문등 정상적인 ... frame-by.co.kr ']"
2021-03-01,[내돈내산] 마리몬드 핸드폰 케이스,https://blog.naver.com/dlqmsejdro82/222260691943,"[' 안녕하세요, 알리입니다. 오늘은 마리몬드 핸드폰 케이스를 리뷰하러 방문하였어요 :) 마리몬드란 홈페이지 소개에서 볼 수 있듯, 인권을 위해 행동하고 폭력에 반대하는 라이프스타일 브랜드라고 합니다. 실제로 지금까지 기부액이 홈페이지에 나와있더라구요. 여러가지 예쁜 케이스들도 정말 많지만, 이러한 선한 움직임에 동참할 수 있어서 기분이 좋았습니다   저는 아이폰 se2 를 사용하는데 자수 케이스가 단돈 3,900원 물론 이 가격은 갤럭시 s8+ 에 해당하는 가격입니다. 아이폰은 이 가격에서 4000원 추가돼요. (구매하실분은 배송비 포함해서 약 1만원이라고 생각하시면 편할 것 같습니다.) 조금 슬픈 이야기를 들려드리자면, 저는 이 케이스가 1만원 정도일때 구매했는데... 그러니까 배송비 포함하면 약 12000원... 지금은 케이스가 7,900원이지만 se2 기종은 품절이라 구매하고 싶어도 못구하네요. 다른 기종은 아직 남아있으니 구매하실 분들은 바로 마리몬드 고고  제 아이폰 se2 입니다. 무난한 검정색이라 질리지 않지만, 좀 어둡기도 합니다 저는 애플페이 대신 카카오 스티커 카드를 붙여서 사용중인데 스티커카드 두께가 두꺼워서 얇은 케이스는 끼우기 쉽지 않아요.  마리몬드 케이스는 플라스틱 재질에 겉은 꽃무늬 자수로 꾸며져 있어요. 밝은 보라색이라 질리지도 않고 케이스가 엄청 두껍지도 무겁지고 않아서 참 마음에 듭니다 아이폰을 옆에 찍었을때 크기의 차이가 거의 없죠 저는 실리콘 케이스도 몇 개 가지고 있는데 실리콘 케이스보다 훨씬 얇아서 생폰 느낌을 살릴 수 있어요 그리고 케이스 안쪽에는 마리몬드 스티커가 붙여져 있습니다. 정품인증 스티커라고 보시면 돼요  케이스를 끼우면 이런 모습입니다. 그리고 케이스 사진만 봐서는 모를 수도 있는데 마리몬드 자수케이스는 오픈형 케이스입니다. 음량 조절 버튼/전원 버튼/위아래(전원부포함) 모두 뻥뚫려있어서 아이폰이 완전히 보호되지는 않아요 저도 구매하고 나서 오픈형인 걸 알고 몇달간 사용하지 않았답니다. 지금은 사용한지 6개월 정도 되어, 예전만큼 애지중지하지도 않고 생각보다 핸드폰을 떨어뜨릴 일이 없더라구요. (여러분 꼭 작은 폰 쓰십쇼. 핸드폰 클때는 2년동안 3번의 액정파손을 겪었던 저인데... 작은폰쓰니 안떨어뜨립니다..) 그래서 쿨하게 오픈형 케이스 끼워서 사용중이랍니다  그리고 중요한 것 물에 젖어도 금방 마르더라구요. 아마 면이 아니라 인공섬유를 사용한 건가봐요. 세면대에 올려놔도 휴지로 쓱- 닦으면 금방 말라서 위생적이에요.  그럼 이만 마리몬드 자수 케이스 후기를 마치겠습니다  일상 내돈내산 마리몬드 자수케이스 핸드폰케이스 아이폰케이스 마리몬드케이스 후기 리뷰 할인 리얼리뷰 장단점']"
2021-02-01,iOS 14.5 어떻게Apple Watch로 아이폰을 잠금해제할까?,https://blog.naver.com/montrealpoutine/222228908596,"["" iOS14.5에서 마스크 착용시 페이스아이디가 먹통일 때 애플워치를 이용해서 잠금해제 기능이 업데이트 될 것이다라고 했는데요. 9to5Mac에서 어떻게 애플워치를 통해서 잠금해제를 할 수 있는지에 대해서 설명을 했습니다.  첫번째로 iOS14.5가 필요하고(현재는 베타1 버젼) 애플워치에는 WatchOS7.4(이 역시도 베타1버젼) 가 필요합니다. 현재로서는 공개된 베타버젼은 없지만(그래도 다운로드는 가능하죠) 이번주내로 베타가 풀릴 것으로 예상한답니다.  Apple Watch로 iPhone 잠금 해제 Apple Watch로 잠금 해제 기능을 사용하려면 iPhone의 환경설정에서 Face ID & Passcode 설정에 들어갑니다. 그리고 AppleWatch 부분을 선택한 후에 다음과 같은 경우에 이 기능을 사용할 수 있다고 합니다.  1. 얼굴 ID가 마스크를 감지함 2. Apple Watch가 근처에 있음 3. 당신의 애플 워치는 당신의 손목에 있다. 4. Apple Watch가 잠금 해제됨 5. Apple Watch에 암호가 사용되도록 설정됨  여기서 명심해야 할 또 다른 사항은 애플워치 손목 인식 기능을 비활성화하면 애플워치로 아이폰의 잠금을 해제할 수 없다는 것입니다.  일단 이 기능을 활성화하면 다음에 페이스 마스크를 착용하면 애플워치로 아이폰의 잠금이 자동으로 해제됩니다. 아이폰의 잠금이 해제되면 애플워치에 햅틱진동으로 애플워치로 아이폰의 잠금을 해제했음을 알려줍니다. 애플워치 알림에서 직접 '아이폰 잠금'을 빠르게 할 수 있는 옵션도 있습니다.  이 기능은 사실 Mac의 잠금해제를 하는 방식과 유사합니다. 하지만 몇가지 제한이 있는데요. 오직 마스크를 착용한 채 아이폰 잠금해제에 국한된다고 합니다. 그리고 마스크를 쓰고 있는지 아이폰이 감지할 수 없다면 작동하지 않고, 애플페이, 신용카드, Wallet의 애플 카드와는 사용할 수 없다고 합니다. 이러한 경우 마스크를 착용하고 있다면 여전히 암호를 입력해야 합니다. 이 기능이 페이스아이디나 암호를 입력하는 것에 비해서 안전하지는 않지만 편리한 것은 사실 입니다.  아래의 링크된 트윗의 동영상에서 설명은 복잡했지만 얼마나 간단하게 동작하는지 확인할 수 있을 것 입니다.  애플이 당장 페이스 아이디의 불편함을 해결하기 위해서 아이디어를 짜내는 것 같아서 이로 인해 불편한 사람들에게 조금이라도 도움은 될 것 같다는 생각이 들지만 모든 사람들이 애플워치를 사용하는 것은 아니기 때문에 궁극적인 해결방법은 아니라는 점에서 아쉽기는 합니다. 아마 이러한 불편함은 아이폰12s(또는13) 에서 디스플레이 터치아이디가 추가 된다면 많이 해결 될 것 같습니다. 하지만 터치아이디가 추가되더라도 이 기능은 사라지지 않을 것 같네요.   ""]"
2021-02-01,[코린이용] 비트 50K 돌파원인 기관호재 총정리&전망,https://blog.naver.com/kpi91/222245694201,"["" 비트코인 사상최초 최고가 50K (한화 약 5500만원) 돌파 (2021년 2월 16일 기준 빗썸 메이저분류 참고) 2017년 비트코인이 한창 핫할때 열배 이상 상승했던 비트코인 가격을 보면서 누구나 그런생각을 했을거야 아 그때로 돌아가면 비트코인 샀을텐데, 시간을 돌릴수만 있다면 비트코인을 사고싶다 그런의미에서 오늘은 비트코인 사상최고가 50K 돌파 기념 2021년 2월 16일의 고가와 작년 코로나 쇼크로 역대급 매수찬스, 저점을 줬던 2020년 3월 13일의 저가를 비교해봤어. 역시 가장 눈에 띄는건 비트코인이야. 비트코인은 오늘 상승으로 1) 사상 최고가 경신 2) 2020년 이후 1년도 안되서 10배 이상 가격 상승 , 3) 시총 1000조 돌파 의 기록을 달성했어. 과연 2017년 비트코인 떡상할당시 '시간을 돌리면 산다던' 흑우형들이 이번 2020년 저점에 비트코인을 샀을까싶어 그때 못샀던 형들은 지금도 못사고 눈만 깜빡거리고 있지 않을까 오늘은 다른 메이저 알트들도 좋지만 우선은 비트코인 관련 기관 호재들을 총 정리해서 모아보기로했어. 2020년 중순부터 다수의 기관 투자자들이 주목하기 시작했는데 그 시작이 무엇인지, 어떤 기관들이 참여했는지 알아보자구 1차 떡상의 원인 -by 페이팔 지난 2020년 10월 송금 결제업체 페이팔의 비트코인 매매서비스 출시발표가 본격적인 기관진입과 떡상의 시작이라고 볼수있어. 페이팔은 고객이 페이팔을 통해 비트코인,이더리움,비트코인캐시,라이트코인을 구매하거나 판매, 보관할수 있도록 하겠다고 발표했지. 댄 슐먼 페이팔 최고경영자(CEO)는 화폐가 디지털 형태로 바뀌는 건 필연적이라며 이 서비스가 전세계적으로 가상 코인(Virtual Coin)의 사용을 장려하길 희망한다고 밝히며 중앙은행이 발행하는 디지털화폐(CBDC)와 리브라 등 기업이 발행하는 디지털화폐의 대중화를 대비하는 차원이라고 언급했어. (2021년 2월 16일 빗썸 기준 비트코인 월봉) 비트코인은 국내거래소 기준 10월달 시가 1350만원대에서 페이팔의 호재 발표이후 2020년 말일 3150만원대까지 약 130%가 상승했어. 코로나 쇼크인 3월 시가 대비해서 연말까지 약 6배 가량 급등한 셈이지 2차 떡상의 원인 -by 테슬라 2월 8일 미국증권거래소(SEC)에 제출한 연례보고서에 따르면 테슬라는 2021년 1월 비트코인 15억달러 (한화 약 1조 7천억)를 매입했어. 테슬라는 제출자료에서 현금 수익을 다양화하고 수익을 극대화 하는 등 더 많은 유연성을 확보하는 차원에서 비트코인을 매입했다고 밝혔지. 테슬라는 장기적으로 디지털자산을 취득하고 보유할 수 있으며, 심지어 가까운 장래에 테슬라 제품 지불 수단으로 비트코인을 받을계획이라고해. 앞서 1월 29일 테슬라 CEO이자 전세계 최고 부자 엘론머스크(Elon Musk)가 트위터 프로필에 해시태그로 Bitcoin을 추가한 바도 있었지. 이게 다 테슬라의 비트코인 호재 발표전 복선이였다니.. (2021년 2월 9일 빗썸 기준 비트코인 일봉) 테슬라와 엘론머스크로 인한 비트코인 상승효과는 얼마나 되냐구 1월 29일 비트코인 프로필링크 등록으로 13% 상승했어. 이 양대 장봉을 Elon's Candel (엘론 머스크가 만든 차트다)이라고 불러아 한다는 말까지 있었지. 2월 8일, 9일에는 테슬라의 비트코인 발표로 이틀에 걸쳐 약 20% 상승했어. 그 외 떡상 호재들 - 애플페이, 미국 뉴욕멜론은행 , ETF 승인, 금융기관 진입 애플페이의 비트코인 결제 가능 여부에 대해서도 희소식도 있었지. 다만 이건 애플의 공식적인 결제기능 도입이 아니야. 가상자산 결제서비스업체인 비트페이(BitPay)가 내놓은 비트코인 선불신용카드가 애플페이에 탑재되는 형태로 이루어지는점 참고해둬. 2014년 앱스토어에서 가상자산 관련 전자월렛 앱을 금지했던 애플이 최근 들어 금지조치를 풀고 가상자산 전자월렛 앱 다운로드를 허용했다는 점에서는 추가적인 진입 효과도 기대해 볼 수 있을거같아. 미국에서 가장 오래된 은행으로 알려진 뉴욕멜론은행(BNY Mellon) 이 자산운용사 고객을 위해 올해 말 비트코인 등 암호화폐를 보유, 양도, 발행할 계획이라고 밝혔어. 뉴욕멜론은행 CEO는 비트코인을 다루게 된 배경에 대해  디지털 자산을 위한 통합 서비스 제공 계획을 발표한 첫 번째 글로벌 은행이 된 것이 자랑스럽다면서 “기업 고객들의 수요 증대에 따라 이번 결정을 내린 것”이라고 설명했지. 전통적이고 보수적인 글로벌 은행권에서 비트코인을 다루게 된다는점, 더욱이 그 배경이 기업 고객의 수요 증대라는점에서 주목할만해. 캐나다 금융 당국이 북미 최초로 비트코인 상장지수펀드(ETF) 출시를 승인하면서 미국 SEC의 ETF 승인에 대한 건도 관심을 모으고 있어. 앞서 2018년 당시 비트코인 ETF 승인과 거절에 대한 이슈가 비트코인 가격에 굉장한 영향을 끼쳤었는데 최근 미국 증권거래위원회(SEC) 수장이 바뀌고 주요 기업들이 비트코인을 받아들이는 분위기가 형성되면서 `비트코인 상장지수펀드(ETF)` 출시에 대한 긍정적으로 전망할수 있게 됐지. 코린이라도 들어봅직한 굵직굵직한 금융기관들의 암호화폐 진출 도 속속들이 밝혀지고 있어. 암호화폐가 사기라던 JP모건도 비트코인 시장 진출에 대한 언급했고 , 모건스탠리는 투자 부분에서 비트코인 투자를 검토하고 있다고 밝혔고 , 투자의지가 없다던 골드만삭스는 비밀리에 암호화폐 세미나 개최, 세계 최대 자산 운용사인 미국 블랙록도 비트코인 선물 투자와 투자적격 자산에 비트코인을 추가했어. 기관투자자들의 시장 진입이 본격화 되고있는거지. 50K 돌파 성공, 다음 목표는 100K 2017년처럼 하락장이 시작되지 않을까봐 겁난다구 2017년의 상승장이 그대로 '거품'이라고 비판받을만큼  이렇다 할 이유 없이 상승했다면 2020년부터 이어지는 현재의 상승장은 비트코인의 가치를 알아본 수많은 기업, 기관들의 진입으로 이루어지고 있다는게 큰 차이점이지. 오늘 비트코인 가격이 50K를 돌파한 이후 설마 100K (한화 약 1억 1천만원)까지 상승할 수 있을지에 대해서도 많이들 궁금할거야. 기관 투자자들의 비트코인 장기적 보유, 테슬라등 상장사들의 비트코인 매입, 페이팔, 마스터카드, 비자카드 등 송금 결제 업체의 접근성, 비트코인 상장지수펀드(ETF) 승인 이렇게 현재까지 나온 호재들을 기반으로 이후에 나올 소식들을 기대해보면 여전히 비트코인 상승 동력은 많은 상황이야. 모두 성투하자구  ""]"
2021-02-01,CRYPTO 가상화폐 (암호화폐) 비트코인 (BTC) 갈수록 공급 부족... ,https://blog.naver.com/tradinggosu/222244426006,"["" 주요 기관들의 비트코인 매수가 이어지는 가운데 기관이 보유한 비트코인 수량이 총 유통량의 3%를 넘어섰습니다. 전문가들은 지금과 같은 비트코인 기관 매수세가 지속되면 비트코인 공급 부족 현상이 심화될 것으로 보고 있습니다. 이제 일반인 개미들은 비트코인 만져보지도 못하는 날이 올 수도 있을 듯합니다. 24개 기관투자자 보유 BTC, 총 유통량의 3% 돌파 트레이딩 고수 코인텔레그래프에 따르면 최근 기준으로 24개 글로벌 기관투자자가 46만 500 BTC를 보유하고 있는 것으로 나타났습니다. 현 시세로 추산하면 약 220억 달러(약 24조 2,814억 원)에 달하는 규모입니다.  기관별로 살펴보면 마운트곡스 (MtGox KK)는 14만 1,690 BTC, 블록원 (Block, one)은 14만 BTC, 마이크로스트래티지 (MicroStrategy)는 7.1만 BTC, 테슬라는 3.85만 BTC를 보유하고 있는 것으로 알려졌습니다. 전문가들은 기업들이 인플레이션에 대한 헷징수단으로 비트코인을 보유하는 것이 일반화될 것으로 전망하고 있습니다. 비트코인은 금의 가치 저장을 모방해 유통되고 있으며 추가 채굴을 통해 비트코인의 신규 공급을 늘릴 가능성이 없다는 이유에서입니다.  기관투자자들의 매수세가 지금과 같이 이어질 경우 비트코인이 공급 부족 현상을 겪에 될 것이라는 전망도 나왔습니다. 마이클 노보그라츠(Michael Novogratz) 갤럭시디지털 최고경영자 (CEO)는 지금과 같은 기고나 매수세가 유지될 경우 조만간 심각한 공급 부족 현상이 나타날 것이라고 말했습니다.  비트코인을 대규모로 매수한 기업들은 비트코인을 장기 보관합니다. 기관투자자의 비트코인 장기보유는 시간이 지남에 따라 비트코인 유통감소를 부추기게 됩니다. 대규모 비트코인의 장기 보유가 비트코인의 적은 공급량을 지속적으로 줄이게 된다는 설명입니다. 비트코인 시가총액, 페이스북.테슬라 제쳐 트레이딩 고수 기업의 비트코인 매수가 도전적이며 무모한 움직임으로 여겨졌던 과거와는 달리 이제는 기관 투자자들에게 일반적인 모습이 되고 있습니다. 기업의 비트코인 보유량은 현재 유통중인 비트코인 총 가치의 1/3에 달합니다. 기업의 비트코인 매수가 이어질 경우 비트코인 공급 부족이 심화되며 비트코인 가격을 가파르게 상승시킬 것이라고 관측도 나오고 있습니다.  비트코인의 시가총액이 전체 거래자산 시가총액 중 9위에 올랐습니다. 1000조 원이 조금 넘는 금액입니다. 테슬라의 매입 소식에 오히려 비트코인의 시가총액이 테슬라를 넘어섰습니다. 비트코인을 뒤이어 10위는 테슬라가 차지하고 있으며, 11위는 페이스복이 차지하고 있습니다. 기관투자자 대규모 비트코인 투자 움직임 가속화 트레이딩 고수 최근 트위터의 비트코인 투자 검토 소식과 더블어 글로벌 투자은행 모건스탠리가 자회사를 통해 비트코인 투자를 검토 중인 것으로 알려졌습니다.  블룸버그에 따르면 모건스탠리 자회사인 '카운터포인트 글로벌'은 비트코인 투자 참여를 검토하고 있고, 운용자산 규모가 1500억 달러 (약 166조500억원)에 이르는 대형 자산운용사입니다.  한 매체는 그동안 비트코인에 부정적이었던 모건스탠리가 비트코인에 투자하게 되면 비트코인에 대한 무게가 더 실리고 투자업계가 가상화폐 시장에 본격적으로 뛰어든 대표적인 사례가 될 것이라고 분석했습니다. 암호화폐 결제 서비스 업체 비트페이도 애플페이 월렛을 통한 지원을 시작했다고 밝혔습니다. 비트페이 마스터카드 직불카드 이용자들은 애플페이에 카드를 등록하고 온오프라인에서 결제에 사용할 수 있습니다.  비트코인 대규모 매입 차기 주자로 시총1위 애플도 거론되고 있습니다. 캐나다왕립은행 산하 글로벌 투자은행 RBC캐피털마켓은 최근 보고서를 통해 테슬라에 이어 애플이 비트코인 매수 경쟁에 합류할 수 있다고 전망했습니다. RBC는 애플의 월렛 사업이 애플에게 새로운 기회가 될 것이라고 진단했습니다.""]"
